01/07/2022 00:00:00	argumenti.ru	https://argumenti.ru/society/2022/07/778750	латышские националисты назвали михаила юрьевича лермонтова  офицером геноцида	True	493768	(?=.*).*	(геноцид)	()
14/06/2022 00:00:00	ria.ru	https://ria.ru/20220614/genotsid-1795326843.html	судебный процесс о геноциде советского народа начнется в крыму    июня	True	209072	(?=.*).*	(геноцид)	()
15/06/2022 00:00:00	ria.ru	https://ria.ru/20220615/genotsid-1795344499.html	посол антонов призвал сша прекратить потворствовать геноциду русскоязычных	True	231368	(?=.*).*	(геноцид)	()
17/06/2022 00:00:00	ria.ru	https://ria.ru/20220617/genotsid-1795961747.html	в запорожской области назвали политику киева в отношении крыма геноцидом	True	227357	(?=.*).*	(геноцид)	()
24/06/2022 00:00:00	ria.ru	https://ria.ru/20220624/belorussiya-1797779712.html	минск обратится к зарубежным странам по делу о геноциде	True	239296	(?=.*).*	(геноцид)	()
24/06/2022 00:00:00	ria.ru	https://ria.ru/20220624/rusofobiya-1797821456.html	краснов сравнил русофобию на западе с геноцидом	True	239349	(?=.*).*	(геноцид)	()
26/06/2022 00:00:00	ria.ru	https://ria.ru/20220627/genotsid-1798286440.html	в крыму рассмотрят дело о геноциде советского народа в годы вов	True	224275	(?=.*).*	(геноцид)	()
07/05/2022 00:00:00	rt.com	https://russian.rt.com/russia/news/1000037-sk-genocid-nacisty-podmoskove	ск возбудил дело о геноциде по факту убийства нацистами пациенток психбольницы в подмосковье	True	241001	(?=.*).*	(геноцид)	()
30/05/2022 00:00:00	rt.com	https://russian.rt.com/russia/news/1009245-sud-moskva-arest-oficery-vs-ukraina	суд в москве заочно арестовал двух командиров всу по обвинению в геноциде	True	253013	(?=.*).*	(геноцид)	()
15/06/2022 00:00:00	rt.com	https://russian.rt.com/world/news/1014902-antonov-genocid-naseleniya-ssha	посол антонов  призываем сша прекратить потворствовать геноциду русскоязычного населения	True	251923	(?=.*).*	(геноцид)	()
27/05/2022 00:00:00	ura.news	https://ura.news/news/1052556912	мо   правый сектор   открыто призывает к геноциду русских в днр	True	299046	(?=.*).*	(геноцид)	()
20/01/2022 00:00:00	ural.kp.ru	https://pda.ural.kp.ru/daily/27353/4534333/	геноцид не может быть внутренним делом ни одной страны  это трагедия всего человечества в целом	True	5910	(?=.*).*	(геноцид)	()
17/02/2022 00:00:00	regnum.ru	https://regnum.ru/news/3509548.html	власти сша назвали  ложью  заявления россии о геноциде в донбассе	True	365087	(?=.*).*	(геноцид)	()
18/02/2022 00:00:00	regnum.ru	https://regnum.ru/news/3510966.html	володин винит запад в двойных стандартах в вопросе геноцида на украине	True	390567	(?=.*).*	(геноцид)	()
18/02/2022 00:00:00	regnum.ru	https://regnum.ru/news/polit/3508217.html	путин  украинские власти устроили геноцид в донбассе	True	366597	(?=.*).*	(геноцид)	()
19/02/2022 00:00:00	regnum.ru	https://regnum.ru/news/polit/3512388.html	сеть   в донбассе геноцид     россия ознакомила оон с преступлениями киева	True	366505	(?=.*).*	(геноцид)	()
20/02/2022 00:00:00	regnum.ru	https://regnum.ru/news/polit/3512299.html	антонов  сша отвергают геноцид русских  сеть   америка   образец цинизма	True	364017	(?=.*).*	(геноцид)	()
23/02/2022 00:00:00	regnum.ru	https://regnum.ru/news/3515434.html	генсек оон отказался назвать геноцидом происходящее в донбассе	True	367330	(?=.*).*	(геноцид)	()
23/02/2022 00:00:00	regnum.ru	https://regnum.ru/news/polit/3515692.html	москалькова  ситуация в донбассе отвечает всем признакам геноцида	True	366705	(?=.*).*	(геноцид)	()
25/02/2022 00:00:00	regnum.ru	https://regnum.ru/news/3518074.html	в  общественной защите  назвали действия украины в донбассе геноцидом	True	364389	(?=.*).*	(геноцид)	()
25/02/2022 00:00:00	regnum.ru	https://regnum.ru/news/3518074.html	в  справедливой защите  назвали действия украины в донбассе геноцидом	True	364390	(?=.*).*	(геноцид)	()
25/02/2022 00:00:00	regnum.ru	https://regnum.ru/news/polit/3517646.html	будапештский меморандум не признаёт переворот и геноцид   лавров	True	365235	(?=.*).*	(геноцид)	()
26/02/2022 00:00:00	regnum.ru	https://regnum.ru/news/3518284.html	геноцид донбасса  казахстан и денацификация украины   новая мировая история	True	363299	(?=.*).*	(геноцид)	()
27/02/2022 00:00:00	regnum.ru	https://regnum.ru/news/polit/3518876.html	геноцид не должен повториться   народный фронт поддержал решение путина	True	363316	(?=.*).*	(геноцид)	()
28/02/2022 00:00:00	regnum.ru	https://regnum.ru/news/polit/3519806.html	спецоперация рф нужна для прекращения геноцида со стороны киева   небензя	True	372392	(?=.*).*	(геноцид)	()
03/03/2022 00:00:00	regnum.ru	https://regnum.ru/news/3522427.html	спецоперация россии прекратит геноцид   мнение	True	377970	(?=.*).*	(геноцид)	()
04/03/2022 00:00:00	regnum.ru	https://regnum.ru/news/3524641.html	путин напомнил шольцу  что   лет запад не замечал геноцида жителей донбасса	True	370787	(?=.*).*	(геноцид)	()
29/01/2022 00:00:00	ria.ru	https://ria.ru/20220129/pamyat-1770123150.html	путин поручил предусмотреть в календарном плане дни памяти жертв геноцида	True	211776	(?=.*).*	(геноцид)	()
03/02/2022 00:00:00	ria.ru	https://ria.ru/20220203/genotsid-1770926930.html	ростовский облсуд принял заявление о признании действий нацистов геноцидом	True	213765	(?=.*).*	(геноцид)	()
06/02/2022 00:00:00	ria.ru	https://ria.ru/20220206/obvinenie-1771296778.html	депутат рады обвинил запад в геноциде украинского народа   риа новости	True	208840	(?=.*).*	(геноцид)	()
07/02/2022 00:00:00	ria.ru	https://ria.ru/20220207/genotsid-1771384270.html	постпред кнр в оон указал на военные преступления и геноцид в сша	True	232848	(?=.*).*	(геноцид)	()
10/02/2022 00:00:00	ria.ru	https://ria.ru/20220210/genotsid-1772165862.html	суд в гааге подтвердил получение заявления о  геноциде мигрантов  в польше	True	220805	(?=.*).*	(геноцид)	()
10/02/2022 00:00:00	ria.ru	https://ria.ru/20220210/migranty-1772067938.html	бежавший в белоруссию солдат назвал миграционную политику польши геноцидом	True	221734	(?=.*).*	(геноцид)	()
10/02/2022 00:00:00	ria.ru	https://ria.ru/20220210/youtube-1772026630.html	youtube запретил ростовскому каналу трансляцию суда по геноциду	True	222819	(?=.*).*	(геноцид)	()
10/02/2022 00:00:00	ria.ru	https://ria.ru/20220210/youtube-1772072713.html	мизулина обратится в ркн после запрета youtube трансляции суда по геноциду	True	221172	(?=.*).*	(геноцид)	()
14/02/2022 00:00:00	ria.ru	https://ria.ru/20220214/genotsid-1772689354.html	в ростовской области суд заслушал показания потерпевших по делу о геноциде	True	217930	(?=.*).*	(геноцид)	()
18/02/2022 00:00:00	ria.ru	https://ria.ru/20220218/genotsid-1773466682.html	антонов обвинил сша в циничном отношении к геноциду русских в донбассе	True	229427	(?=.*).*	(геноцид)	()
18/02/2022 00:00:00	ria.ru	https://ria.ru/20220218/genotsid-1773672722.html	захарова назвала происходящее в донбассе геноцидом со стороны киева	True	212995	(?=.*).*	(геноцид)	()
19/02/2022 00:00:00	ria.ru	https://ria.ru/20220219/blinken-1773830440.html	блинкен  идея о геноциде в донбассе  неверна    риа новости	True	211503	(?=.*).*	(геноцид)	()
19/02/2022 00:00:00	ria.ru	https://ria.ru/20220219/genotsid-1773783778.html	шольц решил  что ведет с путиным историческую дискуссию о термине  геноцид	True	213013	(?=.*).*	(геноцид)	()
19/02/2022 00:00:00	ria.ru	https://ria.ru/20220219/sholts-1773829961.html	член спч прокомментировал слова шольца про геноцид в донбассе	True	216037	(?=.*).*	(геноцид)	()
19/02/2022 00:00:00	ria.ru	https://ria.ru/20220220/genotsid-1773850872.html	столтенберг назвал  ложными  обвинения в геноциде в донбассе   риа новости	True	211836	(?=.*).*	(геноцид)	()
17/01/2022 00:00:00	sputnik-georgia.ru	https://sputnik-georgia.ru/20220117/ot-genotsida-do-adskikh-sanktsiy-zapad-veren-sebe-263667716.html	от геноцида до  адских санкций   запад верен себе               sputnik грузия	True	539282	(?=.*).*	(геноцид)	()
08/02/2022 00:00:00	lenta.ru	https://lenta.ru/news/2022/02/08/porohsud/	порошенко предрекли международный суд из за геноцида жителей донбасса	True	277023	(?=.*).*	(геноцид)	()
15/02/2022 00:00:00	lenta.ru	https://lenta.ru/news/2022/02/15/genocid/	путин назвал происходящее в донбассе геноцидом	True	280290	(?=.*).*	(геноцид)	()
18/02/2022 00:00:00	lenta.ru	https://lenta.ru/news/2022/02/18/posoll/	посол россии назвал цинизмом отрицание сша факта геноцида русских в донбассе	True	278583	(?=.*).*	(геноцид)	()
18/02/2022 00:00:00	lenta.ru	https://lenta.ru/news/2022/02/18/zakharova/	захарова обвинила киев в геноциде на территории донбасса	True	278241	(?=.*).*	(геноцид)	()
21/02/2022 00:00:00	lenta.ru	https://lenta.ru/news/2022/02/21/genocide/	в ростовской области завели дело о геноциде в годы войны	True	277643	(?=.*).*	(геноцид)	()
01/04/2022 00:00:00	lenta.ru	https://lenta.ru/news/2022/04/01/ldprrrr/	в госдуму внесут проект о признании геноцида русских на украине	True	275235	(?=.*).*	(геноцид)	()
06/04/2022 00:00:00	lenta.ru	https://lenta.ru/news/2022/04/06/cz_golodomor/	в чехии в очередной раз признали голодомор геноцидом украинцев	True	280378	(?=.*).*	(геноцид)	()
12/04/2022 00:00:00	lenta.ru	https://lenta.ru/news/2022/04/13/genocid/	байден назвал политику путина на украине  геноцидом	True	281263	(?=.*).*	(геноцид)	()
13/04/2022 00:00:00	lenta.ru	https://lenta.ru/news/2022/04/13/nepriemlemo/	в кремле ответили на слова байдена о  геноциде  украинцев	True	285529	(?=.*).*	(геноцид)	()
13/04/2022 00:00:00	lenta.ru	https://lenta.ru/news/2022/04/13/politika/	байден напрямую назвал политику путина по украине  геноцидом	True	282268	(?=.*).*	(геноцид)	()
13/04/2022 00:00:00	lenta.ru	https://lenta.ru/news/2022/04/13/un_genocide/	в оон прокомментировали заявления байдена о  геноциде  на украине	True	281816	(?=.*).*	(геноцид)	()
14/04/2022 00:00:00	lenta.ru	https://lenta.ru/news/2022/04/14/7747290/	в сша заявили о негативных последствиях слов байдена о геноциде на украине	True	282733	(?=.*).*	(геноцид)	()
14/04/2022 00:00:00	lenta.ru	https://lenta.ru/news/2022/04/14/gtchina/	в китае раскрыли причину обвинения байденом россии в  геноциде	True	282078	(?=.*).*	(геноцид)	()
14/04/2022 00:00:00	lenta.ru	https://lenta.ru/news/2022/04/14/trrramp/	заявление трампа о  геноциде  на украине объяснили	True	283636	(?=.*).*	(геноцид)	()
21/02/2022 00:00:00	pnp.ru	https://www.pnp.ru/social/v-rostovskoy-oblasti-vozbudili-ugolovnoe-delo-o-genocide-v-gody-voyny.html	в ростовской области возбудили уголовное дело о геноциде в годы войны	True	27219	(?=.*).*	(геноцид)	()
24/02/2022 00:00:00	pnp.ru	https://www.pnp.ru/incident/piskarev-sledstvennyy-komitet-vozbudil-bolee-400-del-po-faktam-genocida-v-dnr-i-lnr.html	пискарев  следственный комитет возбудил более     дел по фактам геноцида в днр и лнр	True	29430	(?=.*).*	(геноцид)	()
17/01/2022 00:00:00	pravda.ru	https://www.pravda.ru/news/world/1675513-zakon_o_genocide_belorusskogo_naroda/	закон  о геноциде белорусского народа  вызвал возмущение у прибалтов  украинцев и поляков	True	342778	(?=.*).*	(геноцид)	()
07/02/2022 00:00:00	pravda.ru	https://www.pravda.ru/news/world/1680796-knr_taivan_ssha/	на себя посмотрите  в кнр ответили сша на обвинения в геноциде на тайване	True	350680	(?=.*).*	(геноцид)	()
07/02/2022 00:00:00	pravda.ru	https://www.pravda.ru/news/world/1680796-knr_taivan_ssha/	на себя посмотрите  китай резко ответил сша на обвинения в геноциде на тайване	True	341084	(?=.*).*	(геноцид)	()
15/02/2022 00:00:00	pravda.ru	https://www.pravda.ru/news/politics/1683116-putin/	это и есть геноцид   путин о ситуации в донбассе	True	344417	(?=.*).*	(геноцид)	()
15/02/2022 00:00:00	pravda.ru	https://www.pravda.ru/news/politics/1683116-putin/	это и есть геноцид   путин оценил ситуацию в донбассе	True	344423	(?=.*).*	(геноцид)	()
16/02/2022 00:00:00	pravda.ru	https://www.pravda.ru/news/world/1683519-ssha/	госдеп прокомментировал слова путина о геноциде в донбассе	True	343860	(?=.*).*	(геноцид)	()
18/02/2022 00:00:00	pravda.ru	https://www.pravda.ru/news/politics/1684133-zakharova/	натуральный геноцид   представитель мид рф захарова о происходящем в донбассе	True	342905	(?=.*).*	(геноцид)	()
19/02/2022 00:00:00	pravda.ru	https://www.pravda.ru/news/politics/1684244-slova_sholca_o_genocide_na_donbasse_mogut_stoit_emu_posta/	слова шольца о геноциде в донбассе могут стоит ему поста канцлера   политолог баширов	True	348814	(?=.*).*	(геноцид)	()
22/02/2022 00:00:00	pravda.ru	https://www.pravda.ru/news/world/1684983-lnr_pasechnik_donbass/	геноциду в донбассе подвергается русский народ  заявил глава лнр пасечник	True	343885	(?=.*).*	(геноцид)	()
23/02/2022 00:00:00	pravda.ru	https://www.pravda.ru/news/world/1685328-priznanie_ldnr_oon/	в оон осудили признание россией лднр  геноцида в донбассе нет	True	345743	(?=.*).*	(геноцид)	()
23/02/2022 00:00:00	pravda.ru	https://www.pravda.ru/news/world/1685328-priznanie_ldnr_oon/	в оон осудили признание рф лднр  геноцида в донбассе нет	True	345821	(?=.*).*	(геноцид)	()
25/02/2022 00:00:00	pravda.ru	https://www.pravda.ru/world/1684867-donbass/	политолог  геноцид русских идёт уже     лет	True	343220	(?=.*).*	(геноцид)	()
16/03/2022 00:00:00	bloknot.ru	https://bloknot.ru/regiony/v-rostove-na-donu-sud-priznal-zverstva-nemetsko-fashistskih-zahvatchikov-vo-vremya-vov-genotsidom-900078.html	в ростове на дону суд признал зверства немецко фашистских захватчиков во время вов геноцидом	True	45616	(?=.*).*	(геноцид)	()
15/02/2022 00:00:00	info.sibnet.ru	https://info.sibnet.ru/article/610375/	путин назвал ситуацию в донбассе геноцидом	True	52723	(?=.*).*	(геноцид)	()
18/02/2022 00:00:00	riafan.ru	https://riafan.ru/1609519-posol-antonov-oproverzhenie-genocida-russkoyazychnyh-v-donbasse-yavlyaetsya-verhom-cinizma-ssha	посол антонов  опровержение геноцида русскоязычных в донбассе является верхом цинизма сша	True	415183	(?=.*).*	(геноцид)	()
18/02/2022 00:00:00	riafan.ru	https://riafan.ru/1609586-volodin-obvinil-ukrainu-v-genocide-mirnyh-lyudei-v-donbasse	володин обвинил украину в геноциде мирных людей в донбассе	True	409544	(?=.*).*	(геноцид)	()
18/02/2022 00:00:00	riafan.ru	https://riafan.ru/1610134-mid-rossii-obvinil-kiev-v-genocide-na-territorii-respublik-donbassa	мид россии обвинил киев в геноциде на территории республик донбасса	True	409020	(?=.*).*	(геноцид)	()
19/02/2022 00:00:00	riafan.ru	https://riafan.ru/1610608-kancler-germanii-sholc-zayavil-o-diskussii-s-putinym-po-povodu-termina-genocid	канцлер германии шольц заявил о дискуссии с путиным по поводу термина  геноцид	True	408904	(?=.*).*	(геноцид)	()
19/02/2022 00:00:00	riafan.ru	https://riafan.ru/1610785-volodin-nazval-cinichnym-otricanie-sholcem-genocida-v-donbasse	володин назвал циничным отрицание шольцем геноцида в донбассе	True	408000	(?=.*).*	(геноцид)	()
21/02/2022 00:00:00	riafan.ru	https://riafan.ru/1611468-simonyan-dovela-soloveva-do-slez-slovami-o-genocide	симоньян довела соловьева до слез словами о геноциде	True	412929	(?=.*).*	(геноцид)	()
22/02/2022 00:00:00	riafan.ru	https://riafan.ru/1612572-prodyuser-solncepeka-my-zhe-rasskazyvali-rebyata-tam-ubivayut-russkikh-tam-genocid-spasaite	продюсер  солнцепека   мы же рассказывали   ребята  там убивают русских  там геноцид  спасайте	True	411378	(?=.*).*	(геноцид)	()
22/02/2022 00:00:00	riafan.ru	https://riafan.ru/1612610-goneniya-diskriminaciya-ubiistva-pochemu-deistviya-ukrainy-v-donbasse-mozhno-nazvat-genocidom	гонения  дискриминация  убийства  почему действия украины в донбассе можно назвать геноцидом	True	411517	(?=.*).*	(геноцид)	()
22/02/2022 00:00:00	riafan.ru	https://riafan.ru/1612622-nad-chem-smeetsya-olaf-sholc-kancler-germanii-predpochel-ne-zametit-genocid-v-donbasse	над чем смеется олаф шольц  канцлер германии предпочел не заметить геноцид в донбассе	True	412078	(?=.*).*	(геноцид)	()
22/02/2022 00:00:00	riafan.ru	https://riafan.ru/1612824-chto-dalshe-zhdat-genocida-putin-vyskazalsya-o-nevypolnenii-kievom-minskih-soglashenii	что дальше ждать  геноцида    путин высказался о невыполнении киевом минских соглашений	True	412102	(?=.*).*	(геноцид)	()
22/02/2022 00:00:00	riafan.ru	https://riafan.ru/region/svs/1612636-senator-kolbin-vse-drugie-vozmozhnosti-zashitit-ot-genocida-zhitelei-donbassa-byli-ischerpany	сенатор колбин  все другие возможности защитить от геноцида жителей донбасса были исчерпаны	True	412094	(?=.*).*	(геноцид)	()
23/02/2022 00:00:00	riafan.ru	https://riafan.ru/1613059-glava-fonda-borby-s-repressiyami-terada-o-genocide-kieva-protiv-dnr-i-lnr-vse-prestupniki-budut-nakazany	глава фонда борьбы с репрессиями тэрада о геноциде киева против днр и лнр  все преступники будут наказаны	True	409998	(?=.*).*	(геноцид)	()
23/02/2022 00:00:00	riafan.ru	https://riafan.ru/1613416-deputat-gosdumy-valuev-interesno-pochemu-genocid-v-donbasse-tak-nasmeshil-kanclera-frg-sholca	депутат госдумы валуев   интересно  почему геноцид в донбассе так насмешил канцлера фрг шольца	True	410345	(?=.*).*	(геноцид)	()
23/02/2022 00:00:00	riafan.ru	https://riafan.ru/1613533-nebenzya-rossiya-ne-mogla-ostatsya-bezuchastnoi-k-ldnr-v-usloviyah-neprikrytogo-genocida	небензя  россия не могла остаться безучастной к лднр в условиях неприкрытого геноцида	True	410376	(?=.*).*	(геноцид)	()
23/02/2022 00:00:00	riafan.ru	https://riafan.ru/1613542-moskalkova-zayavila-chto-proishodyashchee-v-donbasse-otvechaet-vsem-priznakam-genocida	москалькова заявила  что происходящее в донбассе отвечает всем признакам геноцида	True	410098	(?=.*).*	(геноцид)	()
24/02/2022 00:00:00	riafan.ru	https://riafan.ru/1613882-lukashenko-celyu-specoperacii-vs-rf-yavlyaetsya-prekrashchenie-genocida-v-donbasse	лукашенко  целью спецоперации вс рф является прекращение геноцида в донбассе	True	410057	(?=.*).*	(геноцид)	()
24/02/2022 00:00:00	riafan.ru	https://riafan.ru/1614077-deputat-gosdumy-valuev-glavarei-i-uchastnikov-genocida-v-donbasse-zhdet-spravedlivoe-vozmezdie	депутат госдумы валуев   главарей и участников геноцида в донбассе ждет справедливое возмездие	True	410427	(?=.*).*	(геноцид)	()
02/02/2022 00:00:00	tass.ru	https://tass.ru/obschestvo/13590563	заявление о признании геноцидом преступлений нацистов в ростовской области поступило в суд	True	270053	(?=.*).*	(геноцид)	()
04/02/2022 00:00:00	tass.ru	https://tass.ru/proisshestviya/13623943	суд в ростове рассмотрит заявление о признании геноцидом преступлений нацистов    февраля	True	257858	(?=.*).*	(геноцид)	()
19/02/2022 00:00:00	vedomosti.ru	https://www.vedomosti.ru/politics/news/2022/02/19/910107-slova-kantslera	мид россии назвал неприемлемыми слова канцлера фрг шольца о геноциде	True	502656	(?=.*).*	(геноцид)	()
01/04/2022 00:00:00	vedomosti.ru	https://www.vedomosti.ru/politics/news/2022/04/01/916147-22-voennim-vsu	скр предъявил обвинение    украинским военным в геноциде населения донбасса	True	500706	(?=.*).*	(геноцид)	()
13/04/2022 00:00:00	vedomosti.ru	https://www.vedomosti.ru/politics/news/2022/04/13/917954-peskov-otvetil-na-slova-baidena	песков ответил на слова байдена о геноциде на украине	True	504555	(?=.*).*	(геноцид)	()
22/04/2022 00:00:00	regnum.ru	https://regnum.ru/news/3572349.html	мид приднестровья обвинил кишинёв в экономической блокаде и геноциде	True	391967	(?=.*).*	(геноцид)	()
23/04/2022 00:00:00	regnum.ru	https://regnum.ru/news/society/3573435.html	голос турции   погибло         человек  это не геноцид	True	387741	(?=.*).*	(геноцид)	()
24/04/2022 00:00:00	regnum.ru	https://regnum.ru/news/3573901.html	джавахкская диаспора россии  призвала грузию признать геноцид армян	True	391154	(?=.*).*	(геноцид)	()
