fetchdate_orig	page_domain_root	page_url	title_new	OR and OR2 and AND filters	ID	Regex String (AND)	Regex String (OR)	Regex String (OR)#2
15/02/2022 00:00:00	deita.ru	https://deita.ru/article/511130	путин рассказал про геноцид на донбассе	True	44568	(?=.*).*	(геноцид)	()
27/02/2022 00:00:00	deita.ru	https://deita.ru/article/511870	зеленский просит суд уточнить  что такое геноцид	True	27054	(?=.*).*	(геноцид)	()
06/04/2022 00:00:00	anna-news.info	https://anna-news.info/verhovnaya-rada-priznaet-spetsoperatsiyu-rossii-genotsidom-ukrainskogo-naroda/	верховная рада признает спецоперацию россии  геноцидом украинского народа	True	86746	(?=.*).*	(геноцид)	()
15/02/2022 00:00:00	bfm.ru	https://www.bfm.ru/news/493014	путин назвал геноцидом происходящее в донбассе	True	187744	(?=.*).*	(геноцид)	()
19/02/2022 00:00:00	bfm.ru	https://www.bfm.ru/news/493327	в мид рф заявили о неприемлемости слов шольца о геноциде в донбассе	True	187057	(?=.*).*	(геноцид)	()
01/04/2022 00:00:00	bfm.ru	https://www.bfm.ru/news/496651	ск предъявил обвинение в геноциде экс главе минобороны украины	True	185977	(?=.*).*	(геноцид)	()
13/04/2022 00:00:00	bfm.ru	https://www.bfm.ru/news/497241	обвинения в геноциде  комментарий георгия бовта	True	186949	(?=.*).*	(геноцид)	()
13/04/2022 00:00:00	bfm.ru	https://www.bfm.ru/news/497615	кремль назвал  извращением ситуации  заявления байдена о  геноциде  на украине	True	190009	(?=.*).*	(геноцид)	()
13/04/2022 00:00:00	bfm.ru	https://www.bfm.ru/news/497626	в кремле ответили на слова байдена о геноциде на украине и на предложение обмена медведчука на украинских пленных	True	189590	(?=.*).*	(геноцид)	()
14/04/2022 00:00:00	bfm.ru	https://www.bfm.ru/news/497676	ле пен отказалась называть операцию на украине  геноцидом   как байден и трамп	True	189309	(?=.*).*	(геноцид)	()
16/04/2022 00:00:00	bfm.ru	https://www.bfm.ru/news/497834	nbc  заявления байдена о геноциде на украине противоречат данным разведки сша	True	189419	(?=.*).*	(геноцид)	()
12/02/2022 00:00:00	bloknot.ru	https://bloknot.ru/regiony/priznat-prestupleniya-gitlerovtsev-genotsidom-v-rostove-na-donu-sud-reshaet-istoricheski-vazhny-j-vopros-883628.html	признать преступления гитлеровцев геноцидом  в ростове на дону суд решает исторически важный вопрос	True	93684	(?=.*).*	(геноцид)	()
24/04/2022 00:00:00	bloknot.ru	https://bloknot.ru/v-mire/kak-ni-staralis-v-oon-zayavili-chto-priznakov-genotsida-v-hode-spetsoperatsii-ne-nashli-918700.html	как ни старались  в оон заявили  что признаков геноцида в ходе спецоперации не нашли	True	96653	(?=.*).*	(геноцид)	()
20/05/2022 00:00:00	bloknot.ru	https://bloknot.ru/regiony/psiholog-rasskazal-o-novoj-forme-genotsida-rossiyan-930164.html	психолог рассказал о новой форме геноцида россиян	True	87424	(?=.*).*	(геноцид)	()
14/07/2022 00:00:00	bloknot.ru	https://bloknot.ru/politika/oni-eshhe-ne-nachinali-sejchas-my-budem-nachinat-sovetnik-arestovich-proboltalsya-o-planah-ukrainskoj-armii-po-genotsidu-russkih-956989.html	они еще не начинали  сейчас мы будем начинать   советник арестович проболтался о планах украинской армии по геноциду русских	True	73111	(?=.*).*	(геноцид)	()
22/04/2022 00:00:00	deita.ru	https://deita.ru/article/515153	приднестровье обвинило молдавию в геноциде	True	98315	(?=.*).*	(геноцид)	()
01/02/2022 00:00:00	dni.ru	https://dni.ru/polit/2022/2/1/498292.html	белоруссия  против александра лукашенко подали иск в гаагский суд по обвинению в геноциде  последние новости  польша  павел латушко    политика    дни ру	True	192048	(?=.*).*	(геноцид)	()
18/02/2022 00:00:00	duma.gov.ru	http://duma.gov.ru/news/53483/	вячеслав володин обвинил запад в двойных стандартах в ситуации с геноцидом на украине	True	34996	(?=.*).*	(геноцид)	()
26/02/2022 00:00:00	dv.kp.ru	https://pda.dv.kp.ru/daily/27368/4549279/	кожемяко  решения путина отрезвят режим зеленского  направленный на геноцид народа	True	27201	(?=.*).*	(геноцид)	()
17/04/2022 00:00:00	hronika.info	https://hronika.info/mir/791634-bajden-vpervye-nazval-dejstviya-putina-v-ukraine-genoczidom/	байден впервые назвал действия путина в украине геноцидом hronika info	True	68365	(?=.*).*	(геноцид)	()
31/12/2021 00:00:00	informing.ru	https://informing.ru/2021/12/31/kazhdyj-rossijanin-dolzhen-protivostojat-jetomu-prigozhin-podal-zajavlenie-v-sk-po-faktu-genocida-v-donbasse-.html	каждый россиянин должен противостоять этому  пригожин подал заявление в ск по факту геноцида в донбассе	True	78587	(?=.*).*	(геноцид)	()
19/02/2022 00:00:00	infox.ru	https://www.infox.ru/news/300/269714-rossia-gotova-predostavit-dokazatelstva-genocida-na-donbasse	россия готова предоставить доказательства геноцида на донбассе	True	29182	(?=.*).*	(геноцид)	()
14/04/2022 00:00:00	inosmi.ru	https://inosmi.ru/20220414/bayden-253805328.html	болтовня байдена про  геноцид    угроза миру во всем мире	True	321013	(?=.*).*	(геноцид)	()
14/04/2022 00:00:00	inosmi.ru	https://inosmi.ru/20220414/bayden-253806021.html	байден обвинил россию в  геноциде   ему посоветовали посмотреть в зеркало	True	321008	(?=.*).*	(геноцид)	()
14/04/2022 00:00:00	inosmi.ru	https://inosmi.ru/20220414/marin-le-pen-253814685.html	ле пен отказалась называть ситуацию на украине  геноцидом	True	320787	(?=.*).*	(геноцид)	()
15/04/2022 00:00:00	inosmi.ru	https://inosmi.ru/20220415/bayden-253814405.html	белый дом прокомментировал заявление байдена о  геноциде   не обращайте внимания  он просто говорит от всего сердца	True	320881	(?=.*).*	(геноцид)	()
16/04/2022 00:00:00	inosmi.ru	https://inosmi.ru/20220416/bayden-253832373.html	разведка сша не подтверждает слова байдена о  геноциде  на украине	True	321109	(?=.*).*	(геноцид)	()
23/04/2022 00:00:00	inosmi.ru	https://inosmi.ru/20220422/pravosudie-253923390.html	геноцид  в буче и  инциденты  в ираке  запад судит избирательно	True	320649	(?=.*).*	(геноцид)	()
14/07/2022 00:00:00	inosmi.ru	https://inosmi.ru/20220714/nato-255014145.html	заигрывание сша с ядерным армагеддоном на украине граничит с геноцидом	True	323123	(?=.*).*	(геноцид)	()
09/01/2022 00:00:00	iz.ru	https://iz.ru/1274740/2022-01-10/minsk-vozmutil-otkaz-latvii-i-litvy-pomogat-v-rassledovanii-genotcida	минск возмутил отказ латвии и литвы помогать в расследовании геноцида	True	131365	(?=.*).*	(геноцид)	()
27/01/2022 00:00:00	iz.ru	https://iz.ru/1283049/2022-01-27/byvshie-uzniki-natcizma-poprosili-uchredit-den-genotcida-sovetskogo-naroda	бывшие узники нацизма попросили учредить день геноцида советского народа	True	129540	(?=.*).*	(геноцид)	()
28/01/2022 00:00:00	iz.ru	https://iz.ru/1283460/2022-01-28/lukashenko-nameren-dobitsia-mirovogo-priznaniia-genotcida-belorusov-v-vov	лукашенко намерен добиться мирового признания геноцида белорусов в вов	True	129341	(?=.*).*	(геноцид)	()
13/05/2022 00:00:00	military.pravda.ru	https://military.pravda.ru/news/1708329-likvidirovana_vita_zaverukha/	на украине ликвидирована  леди геноцид  вита заверуха   военкор котёнок	True	2636	(?=.*).*	(геноцид)	()
07/05/2022 00:00:00	mskagency.ru	https://www.mskagency.ru/materials/3210021	ск возбудил дело о геноциде по факту убийства более     женщин в подмосковье в      году	True	11260	(?=.*).*	(геноцид)	()
16/01/2022 00:00:00	news-front.info	https://news-front.info/2022/01/16/ot-genotsida-do-adskih-sanktsiy-zapad-ne-izmenyaet-traditsiyam/	от геноцида до  адских санкций   запад не изменяет традициям   последние новости  россии  украины  сирии и мира  новости новороссии  лнр  днр	True	41286	(?=.*).*	(геноцид)	()
06/05/2022 00:00:00	mk.ru	https://www.mk.ru/social/2022/05/06/orlovskiy-sud-priznal-genocidom-ubiystva-zhiteley-nacistami-v-gody-voyny.html	орловский суд признал геноцидом убийства жителей нацистами в годы войны	True	140427	(?=.*).*	(геноцид)	()
10/02/2022 00:00:00	rostov.kp.ru	https://pda.rostov.kp.ru/daily/27362/4543807/	слушание о признании геноцида в годы великой отечественной войны в ростове  прямая трансляция из зала суда	True	73661	(?=.*).*	(геноцид)	()
10/02/2022 00:00:00	rostov.kp.ru	https://pda.rostov.kp.ru/online/news/4624081/	youtube заблокировал донской телеканал перед судом о геноциде в ростове	True	71522	(?=.*).*	(геноцид)	()
15/04/2022 00:00:00	rostov.kp.ru	https://pda.rostov.kp.ru/online/news/4709559/	александр бастрыкин в ростове назвал имена обвиняемых в геноциде офицеров всу	True	58333	(?=.*).*	(геноцид)	()
26/05/2022 00:00:00	rostov.kp.ru	https://pda.rostov.kp.ru/online/news/4762886/	сальск  карьер смерти   фильм о геноциде мирного населения показали студентам вузов	True	126572	(?=.*).*	(геноцид)	()
22/02/2022 00:00:00	rusplt.ru	https://rusplt.ru/society/prigozhin-raskritikoval-kantslera-sholtsa-6214ce3.html	пригожин раскритиковал канцлера шольца за слова про  смехотворность  геноцида в донбассе	True	46026	(?=.*).*	(геноцид)	()
15/02/2022 00:00:00	vz.ru	https://vz.ru/news/2022/2/15/1143814.html	взгляд   путин назвал происходящее сейчас в донбассе геноцидом    новости дня	True	169519	(?=.*).*	(геноцид)	()
17/02/2022 00:00:00	vz.ru	https://vz.ru/news/2022/2/17/1144062.html	взгляд   в госдепе не увидели оснований для заявлений о геноциде в донбассе    новости дня	True	168005	(?=.*).*	(геноцид)	()
18/02/2022 00:00:00	vz.ru	https://vz.ru/news/2022/2/18/1144270.html	взгляд   посол возмутился нежеланием сша признать геноцид русских в донбассе    новости дня	True	168434	(?=.*).*	(геноцид)	()
19/02/2022 00:00:00	vz.ru	https://vz.ru/news/2022/2/19/1144525.html	взгляд   шольц назвал смешными слова о геноциде на донбассе    новости дня	True	168150	(?=.*).*	(геноцид)	()
19/02/2022 00:00:00	vz.ru	https://vz.ru/news/2022/2/19/1144555.html	взгляд   в мид россии прокомментировали заявление шольца о геноциде в днр    новости дня	True	167601	(?=.*).*	(геноцид)	()
19/02/2022 00:00:00	vz.ru	https://vz.ru/news/2022/2/19/1144582.html	взгляд   блинкен назвал  идею о геноциде  в донбассе оскорбительной    новости дня	True	167085	(?=.*).*	(геноцид)	()
24/02/2022 00:00:00	vz.ru	https://vz.ru/news/2022/2/24/1145534.html	взгляд   эксперт  россия должна остановить на украине  гибридный геноцид     новости дня	True	167794	(?=.*).*	(геноцид)	()
07/07/2022 00:00:00	aif.ru	https://aif.ru/politics/sud_priznal_genocidom_prestupleniya_nacistov_v_krymu_v_gody_vov	суд признал геноцидом преступления нацистов в крыму в годы вов	True	182604	(?=.*).*	(геноцид)	()
21/07/2022 00:00:00	ria.ru	https://ria.ru/20220721/ukraina-1803925200.html	в сша хотят  символически  признать действия россии на украине  геноцидом	True	229744	(?=.*).*	(геноцид)	()
19/02/2022 00:00:00	rt.com	https://russian.rt.com/ussr/article/964093-genocid-donbass-ukraina-ssha	примитивный и грубый цинизм   почему сша отрицают геноцид русскоязычного населения в донбассе	True	242906	(?=.*).*	(геноцид)	()
19/02/2022 00:00:00	rt.com	https://russian.rt.com/ussr/news/964704-sholc-genocid-donbass	канцлер фрг шольц назвал нелепыми заявления о геноциде в донбассе	True	243144	(?=.*).*	(геноцид)	()
19/02/2022 00:00:00	rt.com	https://russian.rt.com/ussr/news/964761-ekspert-sholc-genocid-donbass	аналитик неменский раскритиковал слова шольца о нелепости геноцида в донбассе	True	242655	(?=.*).*	(геноцид)	()
20/02/2022 00:00:00	rt.com	https://russian.rt.com/ussr/news/964861-blinken-donbass-genocid	блинкен назвал неверными заявления о геноциде в донбассе	True	242489	(?=.*).*	(геноцид)	()
21/02/2022 00:00:00	rt.com	https://russian.rt.com/russia/news/965937-genocid-donbass-putin	путин  так называемый цивилизованный мир предпочитает не замечать геноцида в донбассе	True	242409	(?=.*).*	(геноцид)	()
27/02/2022 00:00:00	rt.com	https://russian.rt.com/ussr/news/968932-volodin-specoperaciya-ukraina	володин  спецоперация   единственная возможность остановить геноцид русского народа	True	242593	(?=.*).*	(геноцид)	()
15/03/2022 00:00:00	rt.com	https://russian.rt.com/opinion/976099-vityazeva-ukraina-doneck-obstrel-tragediya	настоящий геноцид	True	244437	(?=.*).*	(геноцид)	()
13/04/2022 00:00:00	trud.ru	https://www.trud.ru/article/13-04-2022/1414804_makron_otkazalsja_nazvat_dejstvija_rossii_na_ukraine_genotsidom.html	макрон отказался назвать действия россии на украине геноцидом	True	272880	(?=.*).*	(геноцид)	()
18/04/2022 00:00:00	trud.ru	https://www.trud.ru/article/18-04-2022/1414993_v_mid_frantsii_otkazalis_schitat_sobytija_na_ukraine_genotsidom.html	в мид франции отказались считать события на украине геноцидом	True	273685	(?=.*).*	(геноцид)	()
17/02/2022 00:00:00	vesti.ru	https://www.vesti.ru/article/2678242	госдеп  термин  геноцид  в отношении событий в донбассе неуместен	True	30091	(?=.*).*	(геноцид)	()
17/02/2022 00:00:00	vesti.ru	https://www.vesti.ru/article/2678631	если не геноцид  то что  всу обстреляли    населенных пунктов в донбассе	True	35453	(?=.*).*	(геноцид)	()
19/02/2022 00:00:00	vesti.ru	https://www.vesti.ru/article/2679420	немецким властям советуют не смеяться над геноцидом	True	32630	(?=.*).*	(геноцид)	()
07/05/2022 00:00:00	regnum.ru	https://regnum.ru/news/society/3532736.html	ростовский суд вынесет решение по делу о геноциде советского народа	True	354342	(?=.*).*	(геноцид)	()
07/05/2022 00:00:00	regnum.ru	https://regnum.ru/news/society/3533620.html	суд признал геноцидом преступления нацистов в ростовской области	True	354344	(?=.*).*	(геноцид)	()
07/05/2022 00:00:00	regnum.ru	https://regnum.ru/news/society/3568627.html	ск установил новые факты геноцида советского народа нацистами	True	354338	(?=.*).*	(геноцид)	()
07/05/2022 00:00:00	regnum.ru	https://regnum.ru/news/society/3568993.html	в забайкалье помянули жертв геноцида советского народа	True	354340	(?=.*).*	(геноцид)	()
02/04/2022 00:00:00	ria.ru	https://ria.ru/20220402/obvineniya-1781482079.html	ск заочно обвинил украинских военных в геноциде русскоязычных в донбассе	True	216355	(?=.*).*	(геноцид)	()
04/04/2022 00:00:00	ria.ru	https://ria.ru/20220404/russkie-1781755068.html	в госдуму внесли проект заявления о признании геноцида русских на украине	True	220514	(?=.*).*	(геноцид)	()
27/04/2022 00:00:00	ria.ru	https://ria.ru/20220427/donbass-1785729423.html	западные сми замалчивают геноцид русских в донбассе  заявили в рпц	True	234384	(?=.*).*	(геноцид)	()
27/04/2022 00:00:00	ria.ru	https://ria.ru/20220427/genotsid-1785725043.html	в рпц призвали познакомиться с проектом риа новости о геноциде в донбассе	True	234382	(?=.*).*	(геноцид)	()
01/05/2022 00:00:00	ria.ru	https://ria.ru/20220501/sledstvie-1786425346.html	ск опросил больше тысячи жителей счастья в лнр по делу о геноциде	True	229676	(?=.*).*	(геноцид)	()
03/05/2022 00:00:00	ria.ru	https://ria.ru/20220503/genotsid-1786689028.html	мид лнр назвало гибель более     жителей рубежного геноцидом	True	220370	(?=.*).*	(геноцид)	()
04/05/2022 00:00:00	ria.ru	https://ria.ru/20220504/genotsid-1786882083.html	эксперт  изучение геноцида помогает понять суть украинского неонацизма	True	221440	(?=.*).*	(геноцид)	()
28/02/2022 00:00:00	sputnik-georgia.ru	https://sputnik-georgia.ru/20220228/264835959.html	взгляд из москвы  геноцид  над которым смеется европа	True	541540	(?=.*).*	(геноцид)	()
06/04/2022 00:00:00	sputnik-georgia.ru	https://sputnik-georgia.ru/20220406/ria-novosti-zapustilo-multimediynyy-proekt-o-genotside-naseleniya-dnr-i-lnr-265796372.html	риа новости запустило мультимедийный проект о геноциде населения днр и лнр	True	539577	(?=.*).*	(геноцид)	()
27/01/2022 00:00:00	lenta.ru	https://lenta.ru/news/2022/01/27/fsb_mold/	фсб рассекретила документы о геноциде в молдавии	True	278437	(?=.*).*	(геноцид)	()
27/01/2022 00:00:00	lenta.ru	https://lenta.ru/news/2022/01/27/uzniki/	путина попросили учредить день геноцида советского народа	True	279343	(?=.*).*	(геноцид)	()
09/04/2022 00:00:00	pda.kp.ru	https://pda.kp.ru/online/news/4699889/	посол антонов заявил  что спецоперация россии стала результатом нежелания киева прекратить геноцид русских	True	332979	(?=.*).*	(геноцид)	()
13/04/2022 00:00:00	pda.kp.ru	https://pda.kp.ru/online/news/4705949/	песков назвал неприемлемыми заявления президента сша байдена о  геноциде  на украине	True	334127	(?=.*).*	(геноцид)	()
14/04/2022 00:00:00	pda.kp.ru	https://pda.kp.ru/online/news/4706264/	нуланд  сша намерены признать действия россии на украине  геноцидом	True	332281	(?=.*).*	(геноцид)	()
15/04/2022 00:00:00	pda.kp.ru	https://pda.kp.ru/daily/27380.5/4573252/	ск россии показал    командиров всу  получивших обвинения в геноциде в донбассе	True	332852	(?=.*).*	(геноцид)	()
15/04/2022 00:00:00	pda.kp.ru	https://pda.kp.ru/online/news/4709602/	nbc  заявления байдена о  геноциде  на украине вызвали недоумение у американской разведки	True	333345	(?=.*).*	(геноцид)	()
18/04/2022 00:00:00	pda.kp.ru	https://pda.kp.ru/online/news/4712118/	ск россии возбудил дело в связи с геноцидом русскоговорящего населения лнр украинским военными	True	337243	(?=.*).*	(геноцид)	()
18/04/2022 00:00:00	pda.kp.ru	https://pda.kp.ru/online/news/4712118/	ск россии возбудил дело в связи с геноцидом русскоговорящего населения лнр украинскими военными	True	337273	(?=.*).*	(геноцид)	()
22/04/2022 00:00:00	pda.kp.ru	https://pda.kp.ru/online/news/4719025/	представитель оон шамсадани заявил об отсутствии подтверждающих  геноцид  на украине данных	True	337077	(?=.*).*	(геноцид)	()
24/04/2022 00:00:00	pda.kp.ru	https://pda.kp.ru/online/news/4720448/	nyt назвал попытки байдена назвать события на украине  геноцидом   лицемерными и опасными	True	337266	(?=.*).*	(геноцид)	()
28/04/2022 00:00:00	pda.kp.ru	https://pda.kp.ru/online/news/4726091/	посол рф в оттаве назвал примитивной русофобией канадские заявления о  геноциде  на украине	True	336169	(?=.*).*	(геноцид)	()
22/04/2022 00:00:00	pnp.ru	https://www.pnp.ru/politics/sluckiy-rossiyskie-soldaty-na-ukraine-boryutsya-s-realnym-genocidom.html	слуцкий  российские солдаты на украине борются с реальным геноцидом	True	55693	(?=.*).*	(геноцид)	()
28/02/2022 00:00:00	rapsinews.ru	http://rapsinews.ru/incident_news/20220228/307759212.html	ассоциация юристов россии назвала геноцидом действия киева по отношению к жителям донбасса	True	59224	(?=.*).*	(геноцид)	()
28/02/2022 00:00:00	rapsinews.ru	http://rapsinews.ru/judicial_news/20220228/307757462.html	суд   марта продолжит слушание дела о геноциде жителей ростовской области в годы вов	True	54897	(?=.*).*	(геноцид)	()
08/04/2022 00:00:00	rapsinews.ru	http://rapsinews.ru/historical_memory_publication/20220408/307866410.html	борьба с геноцидом в правовом русле	True	62999	(?=.*).*	(геноцид)	()
24/01/2022 00:00:00	ren.tv	https://ren.tv/news/v-rossii/931395-gp-rossii-prosit-obiavit-prestupleniia-natsistov-pod-rostovom-genotsidom	гп россии просит объявить преступления нацистов под ростовом геноцидом	True	63042	(?=.*).*	(геноцид)	()
22/02/2022 00:00:00	ren.tv	https://ren.tv/blog/dmitrii-rodionov/942365-smeshnoi-genotsid-i-drugie-nomera-nedetskogo-shoumena-olafa-sholtsa	смешной геноцид  и другие номера недетского шоумена олафа шольца	True	64663	(?=.*).*	(геноцид)	()
30/01/2022 00:00:00	ug.ru	https://ug.ru/v-shkolah-poyavyatsya-dni-posvyashhennye-pamyati-o-genoczide-narodov-fashistami/	в школах появятся дни  посвященные памяти о геноциде народов фашистами   учительская газета	True	162695	(?=.*).*	(геноцид)	()
29/07/2022 00:00:00	5-tv.ru	https://www.5-tv.ru/news/396009/sud-priznal-genocidom-ubijstva-mirnyh-zitelej-branska-vovremena-velikoj-otecestvennoj-vojny/	суд признал геноцидом убийства мирных жителей брянска во времена великой отечественной войны	True	121970	(?=.*).*	(геноцид)	()
