24/01/2022 00:00:00	ura.news	https://ura.news/news/1052528940	генпрокуратура раскрыла новый факт геноцида граждан ссср	True	296020	(?=.*).*	(геноцид)	()
06/02/2022 00:00:00	ura.news	https://ura.news/news/1052531434	депутат рады  запад захватил власть на украине и устроил геноцид	True	298589	(?=.*).*	(геноцид)	()
24/02/2022 00:00:00	ura.news	https://ura.news/news/1052534888	валуев  главарей и участников геноцида в донбассе ждет возмездие	True	294522	(?=.*).*	(геноцид)	()
26/02/2022 00:00:00	ura.news	https://ura.news/news/1052535285	зеленский попросил признать действия рф на украине  геноцидом	True	295702	(?=.*).*	(геноцид)	()
02/04/2022 00:00:00	ura.news	https://ura.news/news/1052542965	ск заочно обвинил военных чиновников украины в геноциде	True	298183	(?=.*).*	(геноцид)	()
13/04/2022 00:00:00	ura.news	https://ura.news/news/1052545422	макрон отказался называть  геноцидом  происходящее на украине	True	299726	(?=.*).*	(геноцид)	()
13/04/2022 00:00:00	ura.news	https://ura.news/news/1052545532	песков ответил на обвинения байдена в геноциде	True	297838	(?=.*).*	(геноцид)	()
05/03/2022 00:00:00	regnum.ru	https://regnum.ru/news/polit/3518702.html	мерзкий лжец     сети напомнили зеленскому  кто устроил геноцид на украине	True	361859	(?=.*).*	(геноцид)	()
05/03/2022 00:00:00	regnum.ru	https://regnum.ru/news/polit/3524847.html	готовится геноцид всех  москалей  без разбора   кургинян о нацизме запада	True	367719	(?=.*).*	(геноцид)	()
10/03/2022 00:00:00	regnum.ru	https://regnum.ru/news/3528676.html	геноцид русских  китайцы высказались о целях биолабораторий сша на украине	True	372233	(?=.*).*	(геноцид)	()
14/03/2022 00:00:00	regnum.ru	https://regnum.ru/news/3532707.html	мир призвали предотвратить геноцид хазарейцев в афганистане при талибах	True	373120	(?=.*).*	(геноцид)	()
14/03/2022 00:00:00	regnum.ru	https://regnum.ru/news/society/3532800.html	для всу геноцид   обычное дело    сеть о ракетном ударе всу по донецку	True	367746	(?=.*).*	(геноцид)	()
15/03/2022 00:00:00	regnum.ru	https://regnum.ru/news/society/3503057.html	youtube запретил трансляцию суда по делу о геноциде советского народа	True	360169	(?=.*).*	(геноцид)	()
17/03/2022 00:00:00	regnum.ru	https://regnum.ru/news/polit/3535116.html	призывы украинского ведущего к геноциду русских в сжр назвали фашизмом	True	358555	(?=.*).*	(геноцид)	()
10/01/2022 00:00:00	rueconomics.ru	https://rueconomics.ru/559987-glava-parlamenta-car-rasskazal-o-roli-rossiyan-v-predotvrashchenii-genocida-v-centralnoi-afrike	глава парламента цар рассказал о роли россиян в предотвращении геноцида в центральной африке	True	525776	(?=.*).*	(геноцид)	()
28/05/2022 00:00:00	rueconomics.ru	https://rueconomics.ru/23459674-mo_rossii_soobschilo_o_prizivah_k_genotsidu_russkoyazichnih_v_dnr_so_storoni_pravogo_sektora	мо россии сообщило о призывах к геноциду русскоязычных в днр со стороны  правого сектора	True	527157	(?=.*).*	(геноцид)	()
09/06/2022 00:00:00	rueconomics.ru	https://rueconomics.ru/23479616-prokuratura_pol_shi_odobrila_banderovskii_lozung_s_prizivom_k_genotsidu_mestnih_zhitelei	прокуратура польши одобрила бандеровский лозунг с призывом к геноциду местных жителей	True	528506	(?=.*).*	(геноцид)	()
26/02/2022 00:00:00	kommersant.ru	https://www.kommersant.ru/doc/5237215	зеленский попросил генсека оон признать геноцидом действия россии	True	512286	(?=.*).*	(геноцид)	()
02/03/2022 00:00:00	kommersant.ru	https://www.kommersant.ru/doc/5237515	международный суд оон получил иск украины против россии о геноциде	True	513026	(?=.*).*	(геноцид)	()
18/03/2022 00:00:00	kommersant.ru	https://www.kommersant.ru:443/doc/5268938	путин  главная цель военной операции россии на украине   избавить людей от геноцида	True	509932	(?=.*).*	(геноцид)	()
14/04/2022 00:00:00	kommersant.ru	https://www.kommersant.ru/doc/5306359	псаки  слова байдена о  геноциде    его личное мнение	True	513114	(?=.*).*	(геноцид)	()
15/04/2022 00:00:00	kommersant.ru	https://www.kommersant.ru:443/doc/5315491	nbc  некоторые чиновники сша обеспокоены словами байдена о геноциде на украине	True	511764	(?=.*).*	(геноцид)	()
21/04/2022 00:00:00	kommersant.ru	https://www.kommersant.ru/doc/5318033	второго латвийского гражданства будут лишать за поддержку военной агрессии и геноцида	True	518552	(?=.*).*	(геноцид)	()
24/04/2022 00:00:00	kommersant.ru	https://www.kommersant.ru/doc/5326773	пашинян заявил  что международное признание геноцида армян снизит напряженность в регионе	True	516560	(?=.*).*	(геноцид)	()
25/04/2022 00:00:00	kommersant.ru	https://www.kommersant.ru/doc/5327675	эрдоган считает неважными обвинения байденом турции в геноциде армян	True	513161	(?=.*).*	(геноцид)	()
04/03/2022 00:00:00	pda.kp.ru	https://pda.kp.ru/online/news/4653170/	путин напомнил шольцу  что западные партнеры   лет закрывали глаза на геноцид в донбассе	True	326976	(?=.*).*	(геноцид)	()
16/03/2022 00:00:00	pda.kp.ru	https://pda.kp.ru/online/news/4667647/	путин заявил  что жители донбасса в течение восьми лет подвергались геноциду	True	329679	(?=.*).*	(геноцид)	()
18/03/2022 00:00:00	pda.kp.ru	https://pda.kp.ru/online/news/4670848/	путин заявил  что целью спецоперации на украине было избавить людей от геноцида	True	327598	(?=.*).*	(геноцид)	()
20/03/2022 00:00:00	pda.kp.ru	https://pda.kp.ru/online/news/4672114/	французский доброволец кастель заявил  что ситуация в донбассе носит характер геноцида	True	333877	(?=.*).*	(геноцид)	()
28/03/2022 00:00:00	pda.kp.ru	https://pda.kp.ru/daily/27371/4564657/	документальный фильм  донбасс            хронология геноцида	True	324253	(?=.*).*	(геноцид)	()
28/03/2022 00:00:00	pda.kp.ru	https://pda.kp.ru/online/news/4683468/	патрушев назвал целью спецоперации россии на украине защиту людей от геноцида	True	324434	(?=.*).*	(геноцид)	()
29/03/2022 00:00:00	pda.kp.ru	https://pda.kp.ru/online/news/4683906/	вышел фильм о геноциде на донбассе  ставшем причиной спецоперации на украине	True	331150	(?=.*).*	(геноцид)	()
29/03/2022 00:00:00	pda.kp.ru	https://pda.kp.ru/online/news/4683908/	опубликован документальный фильм  донбасс            хронология геноцида	True	331677	(?=.*).*	(геноцид)	()
01/04/2022 00:00:00	pda.kp.ru	https://pda.kp.ru/online/news/4688905/	ск предъявил обвинение в геноциде русскоязычного населения    украинским военным	True	323825	(?=.*).*	(геноцид)	()
04/04/2022 00:00:00	pda.kp.ru	https://pda.kp.ru/daily/27374/4567730/	резню в буче  придумали  чтоб начать геноцид русских	True	332684	(?=.*).*	(геноцид)	()
04/04/2022 00:00:00	pda.kp.ru	https://pda.kp.ru/online/news/4693175/	лдпр внесла в госдуму проект о признании геноцида русских на украине	True	324484	(?=.*).*	(геноцид)	()
04/04/2022 00:00:00	pda.kp.ru	https://pda.kp.ru/online/news/4693338/	байден отказался назвать события в буче  геноцидом	True	330130	(?=.*).*	(геноцид)	()
29/05/2022 00:00:00	riafan.ru	https://riafan.ru/23461707-gossekretar_ssha_blinken_prizval_pekin_perestat_ustraivat_genotsid_uigurov_v_sin_tszyane	госсекретарь сша блинкен призвал пекин перестать устраивать геноцид уйгуров в синьцзяне	True	418028	(?=.*).*	(геноцид)	()
17/07/2022 00:00:00	vesti.ru	https://www.vesti.ru/article/2848002	от мирных заявлений   к геноциду  когда украина упустила свой шанс	True	98102	(?=.*).*	(геноцид)	()
15/02/2022 00:00:00	vse42.ru	https://vse42.ru/news/33503732	геноцид   путин прокомментировал ситуацию в донбассе	True	49347	(?=.*).*	(геноцид)	()
10/02/2022 00:00:00	5-tv.ru	https://www.5-tv.ru/news/375836/rostovskij-sud-nacal-slusania-podelu-ogenocide-sovetskogo-naroda-vovrema-vov/	суд начал слушания по делу о геноциде советского народа	True	71589	(?=.*).*	(геноцид)	()
19/02/2022 00:00:00	5-tv.ru	https://www.5-tv.ru/news/376813/solc-rasskazal-obistoriceskoj-diskussii-sputinym-otermine-genocid/	что шольц рассказал о термине геноцид после беседы с путиным	True	31458	(?=.*).*	(геноцид)	()
26/02/2022 00:00:00	5-tv.ru	https://www.5-tv.ru/news/377710/avm-zaharova-posammitu-nato/	видео  захарова назвала нато соучастником геноцида славян	True	65965	(?=.*).*	(геноцид)	()
27/01/2022 00:00:00	deita.ru	https://deita.ru/article/510042	путину предложили учредить день геноцида	True	31530	(?=.*).*	(геноцид)	()
27/01/2022 00:00:00	deita.ru	https://deita.ru/article/510045	льготный геноцид  кабмин может дать    процентам  забытых  россиян шанс на нормальную жизнь	True	31529	(?=.*).*	(геноцид)	()
29/01/2022 00:00:00	deita.ru	https://deita.ru/article/510150	в россии появится день геноцида	True	17927	(?=.*).*	(геноцид)	()
24/01/2022 00:00:00	fedpress.ru	https://fedpress.ru/news/61/society/2923808	генпрокуратура россии требует признать убийство     тысяч людей в ростовской области геноцидом   ростовская область	True	446421	(?=.*).*	(геноцид)	()
09/01/2022 00:00:00	interfax.ru	https://www.interfax.ru/world/814416	генпрокуратура белоруссии запросила правовую помощь    стран по делу о геноциде белорусов	True	456933	(?=.*).*	(геноцид)	()
07/07/2022 00:00:00	rt.com	https://russian.rt.com/russia/news/1023224-sud-genocid-krym	суд признал геноцидом действия нацистов во время оккупации крыма	True	252171	(?=.*).*	(геноцид)	()
14/07/2022 00:00:00	rt.com	https://russian.rt.com/ussr/news/1025890-sk-rf-rassledovanie-voennye-prestupleniya-germaniya	ск россии установил факты геноцида в годы великой отечественной войны в брянской области	True	254480	(?=.*).*	(геноцид)	()
07/07/2022 00:00:00	tvzvezda.ru	https://tvzvezda.ru/news/2022771022-kjlvt.html	суд крыма признал геноцидом преступления нацистов на полуострове в годы великой отечественной войны	True	485208	(?=.*).*	(геноцид)	()
07/07/2022 00:00:00	tvzvezda.ru	https://tvzvezda.ru/news/2022771651-rOmKh.html	путин назвал изоляцией и геноцидом ситуацию в лднр за последние восемь лет	True	485182	(?=.*).*	(геноцид)	()
14/07/2022 00:00:00	tvzvezda.ru	https://tvzvezda.ru/schedule/programs/201808241352-z30e.htm/202271386-jM1IM.html	выпуск от            г  огневой геноцид из киева и турне безысходности байдена	True	483814	(?=.*).*	(геноцид)	()
25/07/2022 00:00:00	tvzvezda.ru	https://tvzvezda.ru/news/20227251750-xYZBE.html	суд признал геноцидом преступления нацистов на кубани в годы великой отечественной	True	485045	(?=.*).*	(геноцид)	()
24/01/2022 00:00:00	regnum.ru	https://regnum.ru/news/society/3485322.html	нацистские зверства в ростовской области могут признать геноцидом	True	372177	(?=.*).*	(геноцид)	()
27/01/2022 00:00:00	regnum.ru	https://regnum.ru/news/3489285.html	на алтае поддержали инициативу признания геноцида советского народа	True	365118	(?=.*).*	(геноцид)	()
27/01/2022 00:00:00	regnum.ru	https://regnum.ru/news/polit/3489444.html	тему геноцида советского народа выводят на международный уровень   мнение	True	364062	(?=.*).*	(геноцид)	()
27/01/2022 00:00:00	regnum.ru	https://regnum.ru/news/society/3489445.html	депутат госдумы   пора признать блокаду геноцидом советского народа	True	364061	(?=.*).*	(геноцид)	()
28/01/2022 00:00:00	regnum.ru	https://regnum.ru/news/3490409.html	советский народ и статус жертвы геноцида	True	363943	(?=.*).*	(геноцид)	()
05/01/2022 00:00:00	ria.ru	https://ria.ru/20220105/zakon-1766662000.html	лукашенко подписал закон о геноциде белорусского народа в годы войны	True	218674	(?=.*).*	(геноцид)	()
09/01/2022 00:00:00	ria.ru	https://ria.ru/20220109/genotsid-1767080044.html	в минске оценили помощь россии в расследовании дела о геноциде народа бсср	True	215854	(?=.*).*	(геноцид)	()
11/01/2022 00:00:00	ria.ru	https://ria.ru/20220111/genotsid-1767387244.html	важно донести правду о геноциде белорусов во время войны  заявил лукашенко	True	214470	(?=.*).*	(геноцид)	()
18/02/2022 00:00:00	rusplt.ru	https://rusplt.ru/policy/mariya-zakharova-nazvala-proiskhodyashchee-620fdd8.html	мария захарова назвала происходящее в донбассе геноцидом со стороны киевских властей	True	36810	(?=.*).*	(геноцид)	()
03/03/2022 00:00:00	rusplt.ru	https://rusplt.ru/policy/v-chekhii-zaveli-delo-6220af4.html	в чехии завели дело на одобривших российский  геноцид  в украине	True	28512	(?=.*).*	(геноцид)	()
11/05/2022 00:00:00	rusplt.ru	https://rusplt.ru/policy/senat-chekhii-usmotrel-priznaki-627c08a.html	сенат чехии усмотрел признаки геноцида в украине	True	19568	(?=.*).*	(геноцид)	()
13/05/2022 00:00:00	rusplt.ru	https://rusplt.ru/society/opravdanie-genotsida-v-rige-627e119.html	оправдание геноцида   в риге арестовали развернувшего на улице флаг рф латвийца	True	11233	(?=.*).*	(геноцид)	()
18/03/2022 00:00:00	rusprav.tv	https://rusprav.tv/mezhdunarodnyj-sud-oon-v-gaage-vydal-licenziyu-na-genocid-russkix-125727/	международный суд оон в гааге выдал лицензию на геноцид русских	True	20640	(?=.*).*	(геноцид)	()
25/03/2022 00:00:00	rusprav.tv	https://rusprav.tv/ekspert-raskryla-masshtaby-genocida-rusinov-na-ukraine-125918/	эксперт раскрыла масштабы геноцида русинов на украине	True	22454	(?=.*).*	(геноцид)	()
11/05/2022 00:00:00	rusprav.tv	https://rusprav.tv/francuzskij-voenvrach-genocid-v-buche-ukrainsko-amerikanskaya-inscenirovka-127086/	французский военврач   геноцид в буче    украинско американская инсценировка	True	19485	(?=.*).*	(геноцид)	()
25/03/2022 00:00:00	nsktv.ru	https://www.nsktv.ru/news/obshchestvo/rifat_sabitov_ob_otnoshenii_zapada_k_rossiyskim_smi_eto_informatsionnyy_genotsid_/	общество   рифат сабитов об отношении запада к российским сми   это информационный геноцид	True	17617	(?=.*).*	(геноцид)	()
23/01/2022 00:00:00	pda.kp.ru	https://pda.kp.ru/daily/27354.5/4535597/	гарик сукачев   о развале ссср   это было начало большого горя  геноцид русского народа в республиках	True	323642	(?=.*).*	(геноцид)	()
26/02/2022 00:00:00	kazak-center.ru	https://kazak-center.ru/publ/novosti_kazak_inform/naibolee_vazhnye/zapad_po_suti_stal_souchastnikom_genocida_zhitelej_donbassa_zajavil_mid/174-1-0-7551	запад  по сути  стал соучастником геноцида жителей донбасса  заявил мид   наиболее важные   новости киац   каталог статей	True	63235	(?=.*).*	(геноцид)	()
19/02/2022 00:00:00	tvc.ru	http://www.tvc.ru/news/show/id/233533	мид россии вступил в дискуссию с канцлером фрг о геноциде в донбассе	True	46683	(?=.*).*	(геноцид)	()
07/07/2022 00:00:00	riafan.ru	https://riafan.ru/23525411-shkol_nitsa_iz_donbassa_vistupila_protiv_genotsida_detei_i_stala_mishen_yu_ukrainskih_natsionalistov	школьница из донбасса выступила против геноцида детей и стала  мишенью  украинских националистов	True	415297	(?=.*).*	(геноцид)	()
08/07/2022 00:00:00	riafan.ru	https://riafan.ru/23525920-na_kubani_prokuratura_prosit_sud_priznat_genotsidom_prestupleniya_fashistov_vo_vremena_vov	на кубани прокуратура просит суд признать геноцидом преступления фашистов во времена вов	True	425498	(?=.*).*	(геноцид)	()
08/07/2022 00:00:00	riafan.ru	https://riafan.ru/23527098-maliiskii_bloger_meminta_mirotvortsi_oon_lgut_o_provedenii_rassledovaniya_genotsida_v_dialassagu	малийский блогер меминта  миротворцы оон лгут о проведении расследования геноцида в диалассагу	True	422139	(?=.*).*	(геноцид)	()
09/07/2022 00:00:00	riafan.ru	https://riafan.ru/23528021-gazovii_genotsid_zelenskii_mstit_zhitelyam_zaporozhskoi_oblasti	газовый геноцид  зеленский мстит жителям запорожской области	True	435453	(?=.*).*	(геноцид)	()
15/02/2022 00:00:00	apn.ru	https://www.apn.ru/index.php?newsid=41156	путин назвал происходящее в донбассе геноцидом  дума направила обращение о признании днр и лнр	True	57436	(?=.*).*	(геноцид)	()
05/01/2022 00:00:00	argumenti.ru	https://argumenti.ru/history/2022/01/753898	лет назад нацисты устроили геноцид в латгальской деревне	True	490393	(?=.*).*	(геноцид)	()
19/02/2022 00:00:00	argumenti.ru	https://argumenti.ru/politics/2022/02/760392	захарова пообещала направить в фрг материалы о массовых захоронениях в донбассе в ответ на слова шольца о смехотворности геноцида	True	488951	(?=.*).*	(геноцид)	()
03/03/2022 00:00:00	argumenti.ru	https://argumenti.ru/politics/2022/03/762221	путин напомнил макрону о невыполнении украиной минских соглашений и геноциде мирных жителей донбасса	True	491325	(?=.*).*	(геноцид)	()
09/03/2022 00:00:00	argumenti.ru	https://argumenti.ru/society/2022/03/762939	анатолий клёсов  предки западных европейцев начинали с геноцида в европе	True	489651	(?=.*).*	(геноцид)	()
18/02/2022 00:00:00	ren.tv	https://ren.tv/news/v-mire/940764-posol-antonov-nazval-tsinizmom-otritsanie-genotsida-russkikh-na-ukraine	посол антонов назвал цинизмом отрицание геноцида русских на украине	True	97786	(?=.*).*	(геноцид)	()
05/01/2022 00:00:00	rg.ru	https://rg.ru/2022/01/05/podpisan-zakon-o-genocide-belorusskogo-naroda-v-gody-vov.html	подписан закон о геноциде белорусского народа в годы вов	True	156390	(?=.*).*	(геноцид)	()
09/01/2022 00:00:00	rg.ru	https://rg.ru/2022/01/09/rossiia-okazyvaet-sodejstvie-belarusi-v-rassledovanii-dela-o-genocide.html	россия оказывает содействие беларуси в расследовании дела о геноциде	True	155719	(?=.*).*	(геноцид)	()
24/01/2022 00:00:00	rg.ru	https://rg.ru/2022/01/24/v-minske-projdet-mezhdunarodnaia-konferenciia-o-genocide-v-gody-vov.html	в минске пройдет международная конференция о геноциде в годы вов	True	156360	(?=.*).*	(геноцид)	()
25/01/2022 00:00:00	rg.ru	https://rg.ru/2022/01/25/rosarhiv-okazhet-sodejstvie-genprokurature-belarusi-po-delu-o-genocide.html	росархив окажет содействие генпрокуратуре беларуси по делу о геноциде	True	153663	(?=.*).*	(геноцид)	()
29/01/2022 00:00:00	rg.ru	https://rg.ru/2022/01/29/putin-poruchil-predusmotret-dni-pamiati-o-genocide-v-vospitatelnoj-rabote.html	путин поручил предусмотреть дни памяти о геноциде в воспитательной работе	True	153113	(?=.*).*	(геноцид)	()
03/02/2022 00:00:00	rg.ru	https://rg.ru/2022/02/03/reg-ufo/v-rostove-sostoitsia-sudebnyj-process-o-genocide-naseleniia-v-1943-godu.html	в ростове состоится судебный процесс о геноциде населения в      году	True	155176	(?=.*).*	(геноцид)	()
15/02/2022 00:00:00	rg.ru	https://rg.ru/2022/02/15/putin-to-chto-proishodit-sejchas-na-donbasse-genocid.html	путин  то  что происходит сейчас на донбассе   геноцид	True	155722	(?=.*).*	(геноцид)	()
16/03/2022 00:00:00	rt.com	https://russian.rt.com/world/news/976969-sharafmal-genocid-prizyv-reakciya-obse	россия требует от обсе реакции на призыв украинского ведущего к геноциду русских	True	246647	(?=.*).*	(геноцид)	()
17/03/2022 00:00:00	rt.com	https://russian.rt.com/russia/news/977485-ugolovnoe-delo-ukrainskii-veduschii	ск россии возбудил дело в отношении украинского ведущего  призвавшего к геноциду русских	True	243190	(?=.*).*	(геноцид)	()
18/03/2022 00:00:00	rt.com	https://russian.rt.com/ussr/news/977940-putin-specoperaciya-cel	путин  цель спецоперации на украине   избавить людей от геноцида	True	242585	(?=.*).*	(геноцид)	()
01/04/2022 00:00:00	rt.com	https://russian.rt.com/ussr/news/984299-sk-donbass-genocid	ск россии выдвинул обвинение ряду военных украины в геноциде русскоязычных в донбассе	True	239990	(?=.*).*	(геноцид)	()
02/04/2022 00:00:00	rt.com	https://russian.rt.com/ussr/news/985076-sledstvie-genocid-donbass	ск россии заочно обвинил высокопоставленных военных украины по делу о геноциде в донбассе	True	241043	(?=.*).*	(геноцид)	()
07/04/2022 00:00:00	rt.com	https://russian.rt.com/ussr/article/986858-ukraina-genocid-zakonoproekt	провокация от начала и до конца   зачем на украине хотят обвинить россию в  геноциде	True	240502	(?=.*).*	(геноцид)	()
