21 February 2022	True	обращение президента к нации в связи с ситуацией в донбассе	29754	(?=.*).*	(донбасс)	(обстрел|всу|наци)
21 February 2022	True	вооруженные силы украины не прекращают обстреливать населенные пункты донбасса  новости  первый канал	30537	(?=.*).*	(донбасс)	(обстрел|всу|наци)
7 March 2022	True	украинские неонацисты призывают немецких приезжать воевать с силами россии и донбасса  новости  первый канал	22691	(?=.*).*	(донбасс)	(обстрел|всу|наци)
7 March 2022	True	в донбассе весь день не стихают обстрелы со стороны украины  новости  первый канал	27918	(?=.*).*	(донбасс)	(обстрел|всу|наци)
24 January 2022	True	как всу готовится к наступлению на донбасс	61381	(?=.*).*	(донбасс)	(обстрел|всу|наци)
21 February 2022	True	видео  как выглядят пострадавшие от обстрелов села в донбассе	37424	(?=.*).*	(донбасс)	(обстрел|всу|наци)
21 February 2022	True	группа журналистов попала под обстрел в донбассе	45558	(?=.*).*	(донбасс)	(обстрел|всу|наци)
21 February 2022	True	бесконечные обстрелы  что было в донбассе накануне спецоперации	62896	(?=.*).*	(донбасс)	(обстрел|всу|наци)
21 February 2022	True	журналист  известий  прудников вышел на связь после обстрела всу в донбассе	33642	(?=.*).*	(донбасс)	(обстрел|всу|наци)
21 February 2022	True	власти днр заявили о планах всу нанести удары  градами  по городам донбасса	59117	(?=.*).*	(донбасс)	(обстрел|всу|наци)
4 July 2022	True	видео  как и куда всу отступают по всем фронтам на донбассе	89873	(?=.*).*	(донбасс)	(обстрел|всу|наци)
4 July 2022	True	видео  как россия на донбассе  вскрывают  огневые точки всу	89875	(?=.*).*	(донбасс)	(обстрел|всу|наци)
4 July 2022	True	как фонд доктора лизы спасает пострадавших от нацистов в донбассе	122592	(?=.*).*	(донбасс)	(обстрел|всу|наци)
4 July 2022	True	в минобороны рф оценили потери всу в донбассе	105393	(?=.*).*	(донбасс)	(обстрел|всу|наци)
11 July 2022	True	всу теряют более    тысяч человек в месяц на донбассе	125822	(?=.*).*	(донбасс)	(обстрел|всу|наци)
18 July 2022	True	видео  на территории донбасса нашли крупный схрон оружия всу	101961	(?=.*).*	(донбасс)	(обстрел|всу|наци)
18 July 2022	True	почему американские генералы лгут о положении всу в донбассе	103703	(?=.*).*	(донбасс)	(обстрел|всу|наци)
25 July 2022	True	жители донбасса почтили память     погибших из за всу детей и рассказали свои истории	95867	(?=.*).*	(донбасс)	(обстрел|всу|наци)
27 December 2021	True	в днр сообщили о размещении всу бронетехники в населенных пунктах донбасса	181553	(?=.*).*	(донбасс)	(обстрел|всу|наци)
18 July 2022	True	в сша заявили  что западные генералы недоговаривают о положении всу в донбассе   газета ru	313936	(?=.*).*	(донбасс)	(обстрел|всу|наци)
14 February 2022	True	глава лнр пасечник заявил об обстрелах всу по донбассу	154624	(?=.*).*	(донбасс)	(обстрел|всу|наци)
14 February 2022	True	бастрыкин поручил фиксировать преступные действия всу в донбассе	153698	(?=.*).*	(донбасс)	(обстрел|всу|наци)
14 February 2022	True	украинские военные обстреляли еще два населенных пункта в донбассе	155707	(?=.*).*	(донбасс)	(обстрел|всу|наци)
14 February 2022	True	скр возбудил дела по факту артобстрелов донбасса и гибели мирных граждан	153529	(?=.*).*	(донбасс)	(обстрел|всу|наци)
14 February 2022	True	в донбассе в результате обстрела пострадали жилые дома	153512	(?=.*).*	(донбасс)	(обстрел|всу|наци)
14 February 2022	True	всу обстреляли несколько населенных пунктов в донбассе	155425	(?=.*).*	(донбасс)	(обстрел|всу|наци)
21 February 2022	True	представитель рф в оон полянский  запад игнорирует обстрелы в донбассе	155337	(?=.*).*	(донбасс)	(обстрел|всу|наци)
21 February 2022	True	скр возбудил уголовное дело по факту обстрелов населенных пунктов в донбассе	153642	(?=.*).*	(донбасс)	(обстрел|всу|наци)
21 February 2022	True	в совфеде посоветовали киеву прекратить обстрелы донбасса вместо режима чп	155166	(?=.*).*	(донбасс)	(обстрел|всу|наци)
21 February 2022	True	всу разместили семь танков т    у села воздвиженка в донбассе	154689	(?=.*).*	(донбасс)	(обстрел|всу|наци)
21 February 2022	True	днр  военнослужащие    й бригады всу перешли на сторону донбасса	153999	(?=.*).*	(донбасс)	(обстрел|всу|наци)
21 February 2022	True	ск возбудил дела после обстрелов в донбассе и белгородской области	154086	(?=.*).*	(донбасс)	(обстрел|всу|наци)
21 February 2022	True	басурин  украинские националисты решили обстрелять города донбасса из рсзо	153331	(?=.*).*	(донбасс)	(обстрел|всу|наци)
21 February 2022	True	герой днр авидзба  через неделю у всу в донбассе закончатся боеприпасы	153395	(?=.*).*	(донбасс)	(обстрел|всу|наци)
21 February 2022	True	всу из артиллерии бьют по населенным пунктам донбасса	153740	(?=.*).*	(донбасс)	(обстрел|всу|наци)
28 February 2022	True	бастрыкин дал поручения о фиксации новых обстрелов со стороны всу по мирному населению в донбассе	156792	(?=.*).*	(донбасс)	(обстрел|всу|наци)
28 February 2022	True	ск расследует обстрелы украинскими силовиками населенных пунктов донбасса	156742	(?=.*).*	(донбасс)	(обстрел|всу|наци)
28 February 2022	True	скр сообщил об уголовных делах в связи с новыми обстрелами донбасса	156826	(?=.*).*	(донбасс)	(обстрел|всу|наци)
28 February 2022	True	в обесточенной из за обстрелов со стороны украины шахте на донбассе заблокированы    горняка	156864	(?=.*).*	(донбасс)	(обстрел|всу|наци)
14 March 2022	True	александр бастрыкин велел расследовать обстрелы населенных пунктов донбасса	155459	(?=.*).*	(донбасс)	(обстрел|всу|наци)
28 March 2022	True	cаперы всу применили замаскированные мины ловушки в донбассе	156318	(?=.*).*	(донбасс)	(обстрел|всу|наци)
4 April 2022	True	ск возбудил еще два дела после обстрелов украинскими войсками донбасса	157468	(?=.*).*	(донбасс)	(обстрел|всу|наци)
23 May 2022	True	беженка из донбасса рассказала о зверствах украинских националистов	229402	(?=.*).*	(донбасс)	(обстрел|всу|наци)
30 May 2022	True	омбудсмен днр  материалы об обстрелах в донбассе представят на трибунале	234212	(?=.*).*	(донбасс)	(обстрел|всу|наци)
30 May 2022	True	в кремле возмутились ударами всу по гражданской инфраструктуре в донбассе	234219	(?=.*).*	(донбасс)	(обстрел|всу|наци)
30 May 2022	True	ск расследует обстрелы макеевки  пантелеймоновки и стаханова в донбассе	232381	(?=.*).*	(донбасс)	(обстрел|всу|наци)
4 April 2022	True	в днр заявили о поджоге националистами корабля управления  донбасс  в порту мариуполя	248097	(?=.*).*	(донбасс)	(обстрел|всу|наци)
4 April 2022	True	ск возбудил уголовные дела по факту обстрелов населённых пунктов донбасса	247787	(?=.*).*	(донбасс)	(обстрел|всу|наци)
4 April 2022	True	ск россии возбудил дела по фактам новых обстрелов населённых пунктов донбасса	247022	(?=.*).*	(донбасс)	(обстрел|всу|наци)
11 April 2022	True	ск привлёк в качестве обвиняемых ещё    командиров всу по делам о геноциде в донбассе	253875	(?=.*).*	(донбасс)	(обстрел|всу|наци)
18 April 2022	True	ск возбудил уголовное дело против причастного к обстрелам донбасса украинского комбата	249225	(?=.*).*	(донбасс)	(обстрел|всу|наци)
25 April 2022	True	спасли соотечественников от жестокой оккупации   как красная армия освобождала донбасс от нацистов	249239	(?=.*).*	(донбасс)	(обстрел|всу|наци)
25 April 2022	True	ск россии возбудил дело в отношении заместителя командира бригады всу за обстрел донбасса	254518	(?=.*).*	(донбасс)	(обстрел|всу|наци)
2 May 2022	True	минобороны россии  всу и националисты окапываются на химпредприятиях в донбассе	245479	(?=.*).*	(донбасс)	(обстрел|всу|наци)
9 May 2022	True	съёмочная группа военкора rt горшенина попала под обстрел в донбассе	239718	(?=.*).*	(донбасс)	(обстрел|всу|наци)
16 May 2022	True	российские журналисты попали под обстрел в донбассе	251342	(?=.*).*	(донбасс)	(обстрел|всу|наци)
17 January 2022	True	эдуард басурин  всу готовятся к боевым действиям в донбассе	4192	(?=.*).*	(донбасс)	(обстрел|всу|наци)
14 March 2022	True	скр возбудил два уголовных дела из за обстрелов донбасса всу	372234	(?=.*).*	(донбасс)	(обстрел|всу|наци)
14 March 2022	True	бастрыкин поручил расследовать обстрелы донбасса	359967	(?=.*).*	(донбасс)	(обстрел|всу|наци)
14 March 2022	True	по фактам обстрелов в донбассе возбуждены два уголовных дела	378644	(?=.*).*	(донбасс)	(обстрел|всу|наци)
14 March 2022	True	ск рф возбудил два дела по фактам обстрелов военными всу жителей донбасса	378711	(?=.*).*	(донбасс)	(обстрел|всу|наци)
21 March 2022	True	всу обстреляли центр донецка  снаряды разорвались у школы и  донбасс арены	378691	(?=.*).*	(донбасс)	(обстрел|всу|наци)
21 March 2022	True	войска днр за сутки уничтожили    украинских нацистов в донбассе	375607	(?=.*).*	(донбасс)	(обстрел|всу|наци)
21 March 2022	True	бастрыкин  всу применяли  ураганы  и  грады  против мирных жителей донбасса	358580	(?=.*).*	(донбасс)	(обстрел|всу|наци)
28 March 2022	True	ск россии возбудил дела по фактам украинских обстрелов в донбассе	372956	(?=.*).*	(донбасс)	(обстрел|всу|наци)
28 March 2022	True	российские войска прорвали оборону нацистов на юге донбасса   минобороны рф	373281	(?=.*).*	(донбасс)	(обстрел|всу|наци)
28 March 2022	True	ск возбудил новые дела по украинским обстрелам донбасса	359901	(?=.*).*	(донбасс)	(обстрел|всу|наци)
28 March 2022	True	ск возбудил ещё два дела по факту обстрелов донбасса со стороны всу	360335	(?=.*).*	(донбасс)	(обстрел|всу|наци)
28 March 2022	True	ск возбудил ещё два дела по фактам обстрелов донбасса со стороны всу	356578	(?=.*).*	(донбасс)	(обстрел|всу|наци)
28 March 2022	True	ск рф возбудил ещё два дела по факту обстрелов донбасса со стороны всу	356180	(?=.*).*	(донбасс)	(обстрел|всу|наци)
4 April 2022	True	украинские нацисты готовились в марте уничтожить донбасс   небензя	356999	(?=.*).*	(донбасс)	(обстрел|всу|наци)
4 April 2022	True	скр выяснит обстоятельства применения всу мин  лепесток  в донбассе	373309	(?=.*).*	(донбасс)	(обстрел|всу|наци)
4 April 2022	True	ск рф возбудил дела по фактам обстрелов донбасса военными с украины	359916	(?=.*).*	(донбасс)	(обстрел|всу|наци)
4 April 2022	True	басурин оценил численность группировки укронацистов в донбассе	376240	(?=.*).*	(донбасс)	(обстрел|всу|наци)
4 April 2022	True	скр возбудил еще два дела из за обстрела донбасса со стороны украины	375372	(?=.*).*	(донбасс)	(обстрел|всу|наци)
9 May 2022	True	в херсоне открылась фотовыставка о преступлениях всу в донбассе	138436	(?=.*).*	(донбасс)	(обстрел|всу|наци)
23 May 2022	True	кулеба заявил  что ситуация в донбассе чрезвычайно плоха для всу	149486	(?=.*).*	(донбасс)	(обстрел|всу|наци)
3 January 2022	True	зеленский пообещал украинцам снимки бойцов всу из донбасса и крыма	334185	(?=.*).*	(донбасс)	(обстрел|всу|наци)
24 January 2022	True	народная милиция днр заявила  что всу стягивают к донбассу танки и рсзо	332436	(?=.*).*	(донбасс)	(обстрел|всу|наци)
24 January 2022	True	в днр обвинили украинских националистов в вербовке добровольцев для отправки в донбасс	329402	(?=.*).*	(донбасс)	(обстрел|всу|наци)
11 July 2022	True	события в донбассе на          июля  союзные силы окружают северск  всу нанесли удар по стаханову	439132	(?=.*).*	(донбасс)	(обстрел|всу|наци)
11 July 2022	True	лднр получили убойный подарок  для артиллеристов всу в донбассе наступили тяжелые времена	438666	(?=.*).*	(донбасс)	(обстрел|всу|наци)
11 July 2022	True	военный эксперт алехин предрек бегство всу из донбасса в сторону днепра	438634	(?=.*).*	(донбасс)	(обстрел|всу|наци)
11 July 2022	True	коротченко рассказал  как прекратить обстрелы донбасса со стороны всу	436302	(?=.*).*	(донбасс)	(обстрел|всу|наци)
11 July 2022	True	политолог аркатов  всу ведут обстрел мирного населения донбасса по прямому указу вашингтона	426560	(?=.*).*	(донбасс)	(обстрел|всу|наци)
11 July 2022	True	захарова  сша приказали всу обстреливать донбасс из американских рсзо himars	437891	(?=.*).*	(донбасс)	(обстрел|всу|наци)
11 July 2022	True	события в донбассе на          июля  бойцы всу массово дезертируют  союзные силы ждут в краматорске	435436	(?=.*).*	(донбасс)	(обстрел|всу|наци)
11 July 2022	True	юрий кнутов  поражение всу в донбассе может привести к военному перевороту в киеве	434175	(?=.*).*	(донбасс)	(обстрел|всу|наци)
11 July 2022	True	пострадавших при обстрелах всу донбасских детей отправляют на лечение в москву	432350	(?=.*).*	(донбасс)	(обстрел|всу|наци)
11 July 2022	True	сивков объяснил  почему всу используют тактику  выжженной земли  в донбассе	429445	(?=.*).*	(донбасс)	(обстрел|всу|наци)
11 July 2022	True	события на украине на          июля  всу вывозят жителей донбасса в днепропетровск  сша обучат украинских пилотов	429361	(?=.*).*	(донбасс)	(обстрел|всу|наци)
11 July 2022	True	события в донбассе на          июля  в днр сбит су    всу  лнр и харьковская область заключили соглашение о дружбе	429406	(?=.*).*	(донбасс)	(обстрел|всу|наци)
11 July 2022	True	события на украине к          июля  крупные потери всу под северском  киев обстреливает донбасс из himars	427950	(?=.*).*	(донбасс)	(обстрел|всу|наци)
11 July 2022	True	глава организации  пища жизни  донбасс  погиб в результате обстрела алчевска	427380	(?=.*).*	(донбасс)	(обстрел|всу|наци)
11 July 2022	True	события в донбассе на          июля  наступление на соледар  гибель волонтеров при ударе всу по алчевску	427423	(?=.*).*	(донбасс)	(обстрел|всу|наци)
11 July 2022	True	против военных всу возбудили дело из за гибели десяти жителей донбасса под обстрелами	427314	(?=.*).*	(донбасс)	(обстрел|всу|наци)
18 July 2022	True	немецкой журналистке грозит до трех лет тюрьмы за репортажи о преступлениях всу в донбассе	429828	(?=.*).*	(донбасс)	(обстрел|всу|наци)
18 July 2022	True	шойгу поручил жестко пресекать обстрелы жилых кварталов в донбассе со стороны всу	435168	(?=.*).*	(донбасс)	(обстрел|всу|наци)
18 July 2022	True	события в донбассе на          июля  освобождение берестового  всу готовят провокацию в славянске	435250	(?=.*).*	(донбасс)	(обстрел|всу|наци)
4 April 2022	True	ск рф возбудил новые дела из за обстрелов в донбассе	172787	(?=.*).*	(донбасс)	(обстрел|всу|наци)
11 April 2022	True	ск привлек к уголовным делам о геноциде в донбассе еще    командиров всу	177597	(?=.*).*	(донбасс)	(обстрел|всу|наци)
11 April 2022	True	скр завел новые дела после обстрела детсада  школы и больницы в донбассе	177717	(?=.*).*	(донбасс)	(обстрел|всу|наци)
2 May 2022	True	мо  переодетые в форму рф боевики всу напали на граждан в донбассе	172038	(?=.*).*	(донбасс)	(обстрел|всу|наци)
23 May 2022	True	вс рф уничтожили под житомиром перебрасываемое на донбасс вооружение всу	180821	(?=.*).*	(донбасс)	(обстрел|всу|наци)
28 March 2022	True	появились данные о возможном плане всу по дальнейшим действиям на донбассе	56889	(?=.*).*	(донбасс)	(обстрел|всу|наци)
6 June 2022	True	в италии собирают подписи за расследование преступлений всу в донбассе	232041	(?=.*).*	(донбасс)	(обстрел|всу|наци)
13 June 2022	True	в кремле назвали обстрелы в донбассе со стороны украины варварскими	205863	(?=.*).*	(донбасс)	(обстрел|всу|наци)
13 June 2022	True	всу обстреляли выставочный центр  эксподонбасс    риа новости	218166	(?=.*).*	(донбасс)	(обстрел|всу|наци)
20 June 2022	True	вахтовик из нового уренгоя приехал в донбасс забрать семью из под обстрелов	230166	(?=.*).*	(донбасс)	(обстрел|всу|наци)
20 June 2022	True	гатилов указал на заговор молчания запада об обстрелах донбасса	231101	(?=.*).*	(донбасс)	(обстрел|всу|наци)
20 June 2022	True	ск возбудил более     дел об обстрелах донбасса за восемь лет	238620	(?=.*).*	(донбасс)	(обстрел|всу|наци)
20 June 2022	True	американский подполковник заявил о разгроме всу в донбассе	238292	(?=.*).*	(донбасс)	(обстрел|всу|наци)
20 June 2022	True	et  всу столкнулись с большой проблемой в донбассе из за западного оружия	232002	(?=.*).*	(донбасс)	(обстрел|всу|наци)
20 June 2022	True	ск возбудил новые уголовные дела об обстрелах мирных жителей донбасса	224269	(?=.*).*	(донбасс)	(обстрел|всу|наци)
27 June 2022	True	песков  следователи собирают доказательства актов терроризма всу в донбассе	237245	(?=.*).*	(донбасс)	(обстрел|всу|наци)
4 July 2022	True	всу оборудовали огневые позиции в больницах в донбассе  заявило минобороны	224869	(?=.*).*	(донбасс)	(обстрел|всу|наци)
4 July 2022	True	всу оборудовали огневые позиции в больницах донбасса  заявило минобороны	224865	(?=.*).*	(донбасс)	(обстрел|всу|наци)
4 July 2022	True	ск установит обстоятельства обстрела мирных жителей в донбассе	230458	(?=.*).*	(донбасс)	(обстрел|всу|наци)
