21 February 2022	True	небензя  совбез оон должен заставить украину прекратить обстрелы донбасса	530158	(?=.*).*	(донбасс)	(обстрел|всу|наци)
21 February 2022	True	павлова  олимпийское перемирие нарушили  когда во время ои начались обстрелы донбасса	529607	(?=.*).*	(донбасс)	(обстрел|всу|наци)
27 December 2021	True	украина сообщила о ранении своего военнослужащего из за обстрела в донбассе	283265	(?=.*).*	(донбасс)	(обстрел|всу|наци)
10 January 2022	True	в результате украинского обстрела в донбассе погиб ополченец	275714	(?=.*).*	(донбасс)	(обстрел|всу|наци)
28 February 2022	True	всу обстреляли село логвиново в донбассе с использованием рсзо  град	49674	(?=.*).*	(донбасс)	(обстрел|всу|наци)
28 February 2022	True	лавров  массовые захоронения доказывают обстрелы донбасса киевом	59926	(?=.*).*	(донбасс)	(обстрел|всу|наци)
28 February 2022	True	жители сел донбасса жалуются на грабежи со стороны отступающих сил всу	64167	(?=.*).*	(донбасс)	(обстрел|всу|наци)
30 May 2022	True	капитан дандыкин  поднятие корабля  донбасс  раскроет тайны всу	185412	(?=.*).*	(донбасс)	(обстрел|всу|наци)
30 May 2022	True	в риме протестующие потребовали расследовать преступления всу в донбассе	180291	(?=.*).*	(донбасс)	(обстрел|всу|наци)
6 June 2022	True	небензя  киев усилил обстрелы донбасса после обещаний поставить рсзо из сша	183315	(?=.*).*	(донбасс)	(обстрел|всу|наци)
13 June 2022	True	песков назвал обстрелы со стороны украины в донбассе варварскими	172237	(?=.*).*	(донбасс)	(обстрел|всу|наци)
13 June 2022	True	зеленский  всу понесли  болезненные  потери в донбассе и под харьковом	182370	(?=.*).*	(донбасс)	(обстрел|всу|наци)
13 June 2022	True	скр возбудил два дела против военных всу из за обстрелов городов донбасса	182394	(?=.*).*	(донбасс)	(обстрел|всу|наци)
13 June 2022	True	ск  отдававшие приказы об обстреле донбасса два командира всу задержаны	182991	(?=.*).*	(донбасс)	(обстрел|всу|наци)
20 June 2022	True	скр возбудил дела против    военнослужащих всу из за обстрелов донбасса	181554	(?=.*).*	(донбасс)	(обстрел|всу|наци)
20 June 2022	True	солдаты львовского батальона всу отказались ехать в донбасс	182783	(?=.*).*	(донбасс)	(обстрел|всу|наци)
27 June 2022	True	ск возбудил дела против бойцов всу из за обстрелов жителей донбасса	184757	(?=.*).*	(донбасс)	(обстрел|всу|наци)
4 July 2022	True	скр завершил расследование еще    дел о преступлениях всу в донбассе	182618	(?=.*).*	(донбасс)	(обстрел|всу|наци)
21 February 2022	True	ни мир  ни война  как жители донбасса живут на линии фронта и учат детей уходить от обстрелов	20402	(?=.*).*	(донбасс)	(обстрел|всу|наци)
7 March 2022	True	минобороны показало документы с планами всу атаковать донбасс	29094	(?=.*).*	(донбасс)	(обстрел|всу|наци)
4 July 2022	True	ск возбудил дела по фактам обстрелов российских журналистов в донбассе	376021	(?=.*).*	(донбасс)	(обстрел|всу|наци)
4 July 2022	True	ещё    уголовных дел о преступлениях всу в донбассе готовы к передаче в суд	393434	(?=.*).*	(донбасс)	(обстрел|всу|наци)
11 July 2022	True	ск россии расследует новые преступления всу против жителей донбасса	388638	(?=.*).*	(донбасс)	(обстрел|всу|наци)
11 July 2022	True	ск рф завел дела против военных всу  причастных к смерти жителей донбасса	383077	(?=.*).*	(донбасс)	(обстрел|всу|наци)
18 July 2022	True	подполковник сша дэвис  генералы запада врут о положении всу в донбассе	383675	(?=.*).*	(донбасс)	(обстрел|всу|наци)
2 May 2022	True	события в донбассе на         мая  силы лнр расширяют зону контроля у светличного  в рубежном найден тайник всу	413487	(?=.*).*	(донбасс)	(обстрел|всу|наци)
9 May 2022	True	бастрыкин поручил расследовать факты обстрела донбасса и херсона украинскими военными	416365	(?=.*).*	(донбасс)	(обстрел|всу|наци)
9 May 2022	True	события в донбассе на          мая  всу бьют  ураганом  по донецку  эвакуация из мариуполя	417742	(?=.*).*	(донбасс)	(обстрел|всу|наци)
9 May 2022	True	начало конца  освобождение попасной грозит крахом группировке всу в донбассе	417740	(?=.*).*	(донбасс)	(обстрел|всу|наци)
9 May 2022	True	военный эксперт шурыгин  взятие попасной приблизило окончательный разгром всу в донбассе	417679	(?=.*).*	(донбасс)	(обстрел|всу|наци)
9 May 2022	True	в сети появились кадры работы российских  солнцепеков  по позициям всу в донбассе	403855	(?=.*).*	(донбасс)	(обстрел|всу|наци)
9 May 2022	True	события в донбассе на          мая  бои на подступах к угледару  вс рф и силы днр сдавливают нацистов на  азовстали	405574	(?=.*).*	(донбасс)	(обстрел|всу|наци)
9 May 2022	True	российские силы пво перехватили    беспилотников всу в донбассе и харьковской области	413381	(?=.*).*	(донбасс)	(обстрел|всу|наци)
9 May 2022	True	события в донбассе на          мая  раскрыт план атаки националистов на новоазовск  наступление на северодонецк	413362	(?=.*).*	(донбасс)	(обстрел|всу|наци)
9 May 2022	True	сражаются только в последний момент  деян берич назвал главную особенность поведения боевиков всу в донбассе	403259	(?=.*).*	(донбасс)	(обстрел|всу|наци)
9 May 2022	True	политолог бредихин объяснил  зачем всу создают угрозу экологической катастрофы в донбассе	403498	(?=.*).*	(донбасс)	(обстрел|всу|наци)
16 May 2022	True	полковник богодухов  киев использует фейки о победах всу в донбассе ради собственного спасения	434407	(?=.*).*	(донбасс)	(обстрел|всу|наци)
16 May 2022	True	политолог макеева   трибунал по военным преступлениям всу и нацбатов должен состояться в донбассе	428445	(?=.*).*	(донбасс)	(обстрел|всу|наци)
16 May 2022	True	азовсталь  станет триггером  одна ошибка киева спровоцирует повальную сдачу в плен всу в донбассе	435676	(?=.*).*	(донбасс)	(обстрел|всу|наци)
16 May 2022	True	переехавший в донбасс музыкант дмитрий мулыгин высказался о нацизме на украине	431806	(?=.*).*	(донбасс)	(обстрел|всу|наци)
16 May 2022	True	мид лнр  сдавшихся солдат всу привлекли к сбору тел погибших сослуживцев в донбассе	431929	(?=.*).*	(донбасс)	(обстрел|всу|наци)
16 May 2022	True	события в донбассе на          мая  окружение частей всу под лисичанском  над дебальцево сбита  точка у	417554	(?=.*).*	(донбасс)	(обстрел|всу|наци)
16 May 2022	True	события в донбассе на          мая  всу минируют входы в подвалы с мирными жителями  мариуполь станет курортом	428556	(?=.*).*	(донбасс)	(обстрел|всу|наци)
27 December 2021	True	в лнр заявили о занятии всу здания школы в донбассе	247844	(?=.*).*	(донбасс)	(обстрел|всу|наци)
17 January 2022	True	в днр заявили о переброске в донбасс рсзо и подготовке всу  к боевым действиям	240099	(?=.*).*	(донбасс)	(обстрел|всу|наци)
17 January 2022	True	в днр заявили о прибытии в подразделения всу в донбассе большой партии гранатомётов nlaw	240106	(?=.*).*	(донбасс)	(обстрел|всу|наци)
11 April 2022	True	лопнули губы  кровь на стенку   как украинские националисты издеваются над жителями донбасса	487145	(?=.*).*	(донбасс)	(обстрел|всу|наци)
11 April 2022	True	дети горели   журналистка ахмедова о преступлениях всу против мирных граждан донбасса	482897	(?=.*).*	(донбасс)	(обстрел|всу|наци)
11 April 2022	True	наемники из польши и канады  спецслужбы  чвк  кто воюет на стороне всу в донбассе	481223	(?=.*).*	(донбасс)	(обстрел|всу|наци)
2 May 2022	True	не боятся и обезболиваются   как всу выдавали наркотики бойцам нацбата  донбасс	482775	(?=.*).*	(донбасс)	(обстрел|всу|наци)
2 May 2022	True	ск установил еще двух причастных к обстрелам гражданских в донбассе командиров всу	477627	(?=.*).*	(донбасс)	(обстрел|всу|наци)
9 May 2022	True	южные ворота  к группировке всу в донбассе  попасная взята под контроль вс рф и лнр	477701	(?=.*).*	(донбасс)	(обстрел|всу|наци)
16 May 2022	True	ск назвал имя еще одного причастного к обстрелам гражданских в донбассе украинского командира	485728	(?=.*).*	(донбасс)	(обстрел|всу|наци)
23 May 2022	True	в мид украины назвали ситуацию в донбассе плохой для всу	482989	(?=.*).*	(донбасс)	(обстрел|всу|наци)
30 May 2022	True	выпуск от            г  котлы для всу и битва дронов в донбассе	486065	(?=.*).*	(донбасс)	(обстрел|всу|наци)
30 May 2022	True	журналист из сша рассказал о бесчинствах всу в херсонской области и в донбассе	486403	(?=.*).*	(донбасс)	(обстрел|всу|наци)
30 May 2022	True	митингующие в риме призвали расследовать преступления всу в донбассе	483325	(?=.*).*	(донбасс)	(обстрел|всу|наци)
6 June 2022	True	от украинских обстрелов донецка до успехов на передовой  что известно об обстановке в донбассе	486288	(?=.*).*	(донбасс)	(обстрел|всу|наци)
6 June 2022	True	мо рф  украинские неонацисты продолжают использовать гражданскую инфраструктуру донбасса в военных целях	480327	(?=.*).*	(донбасс)	(обстрел|всу|наци)
6 June 2022	True	страшные разрушения  что известно о массированных обстрелах всу городов донбасса	480325	(?=.*).*	(донбасс)	(обстрел|всу|наци)
6 June 2022	True	в италии начали сбор подписей за расследование преступлений всу в донбассе	483841	(?=.*).*	(донбасс)	(обстрел|всу|наци)
6 June 2022	True	ск рф возбудил два дела против украинских военных из за обстрелов городов донбасса	481669	(?=.*).*	(донбасс)	(обстрел|всу|наци)
13 June 2022	True	задержаны два командира всу  отдававшие приказы стрелять по жилым домам в донбассе	485531	(?=.*).*	(донбасс)	(обстрел|всу|наци)
20 June 2022	True	материалы следствия  как всу обрушили семь сотен снарядов и мин за сутки на донбасс    июня	485312	(?=.*).*	(донбасс)	(обстрел|всу|наци)
20 June 2022	True	ск рф возбудил новые уголовные дела против бойцов всу из за обстрелов жителей донбасса	482888	(?=.*).*	(донбасс)	(обстрел|всу|наци)
27 June 2022	True	bild  всу применяют в донбассе немецкие гаубицы	485635	(?=.*).*	(донбасс)	(обстрел|всу|наци)
27 June 2022	True	всу оставляют позиции  что известно о боевых действиях в донбассе	486851	(?=.*).*	(донбасс)	(обстрел|всу|наци)
13 June 2022	True	военные рф уничтожили    генералов и офицеров всу  сеть   за донбасс	373503	(?=.*).*	(донбасс)	(обстрел|всу|наци)
20 June 2022	True	скр возбудил более     дел об обстрелах всу донбасса	401438	(?=.*).*	(донбасс)	(обстрел|всу|наци)
27 June 2022	True	после освобождения славянска всу в донбассе попадут в котел   мвд лнр	386778	(?=.*).*	(донбасс)	(обстрел|всу|наци)
27 June 2022	True	ходаковский объяснил  что даст россии разгром всу в донбассе	393385	(?=.*).*	(донбасс)	(обстрел|всу|наци)
28 March 2022	True	закрывала внука собой от обстрелов  истории эвакуированных жителей донбасса	10002	(?=.*).*	(донбасс)	(обстрел|всу|наци)
14 February 2022	True	донбасс к шести вечера  обстрел россии  бомбы на пути беженцев  эвакуация нато	25254	(?=.*).*	(донбасс)	(обстрел|всу|наци)
21 February 2022	True	ск россии возбудил два новых дела после гибели мирных жителей донбасса из за обстрела	32197	(?=.*).*	(донбасс)	(обстрел|всу|наци)
14 February 2022	True	reuters  в обсе зафиксировали  многочисленные обстрелы  на линии соприкосновения в донбассе	510978	(?=.*).*	(донбасс)	(обстрел|всу|наци)
14 February 2022	True	reuters  в обсе зафиксировали  многочисленных обстрелы  на линии соприкосновения в донбассе	511197	(?=.*).*	(донбасс)	(обстрел|всу|наци)
14 February 2022	True	депутаты верховной рады попали под обстрел в донбассе	509982	(?=.*).*	(донбасс)	(обстрел|всу|наци)
14 February 2022	True	журналисты cnn и afp попали под обстрел в донбассе при сопровождении главы мвд	515006	(?=.*).*	(донбасс)	(обстрел|всу|наци)
21 February 2022	True	украина заявила  что в ходе обстрелов в донбассе погиб один украинский военный	511427	(?=.*).*	(донбасс)	(обстрел|всу|наци)
24 January 2022	True	народная милиция лнр заявила  что всу разместили зенитную установку в жилом районе города в донбассе	326847	(?=.*).*	(донбасс)	(обстрел|всу|наци)
14 February 2022	True	лавров заявил  что россия очень встревожена нарастанием числа обстрелов в донбассе	329008	(?=.*).*	(донбасс)	(обстрел|всу|наци)
14 February 2022	True	главком всу  киев не планирует наступательную операцию в донбассе	328625	(?=.*).*	(донбасс)	(обстрел|всу|наци)
14 February 2022	True	задержанный украинский агент рассказал о планах киева в донбассе  массированные артобстрелы и диверсии	327867	(?=.*).*	(донбасс)	(обстрел|всу|наци)
14 February 2022	True	на украине заявили  что глава партии  слуга народа  попал под обстрел в донбассе	327530	(?=.*).*	(донбасс)	(обстрел|всу|наци)
14 February 2022	True	боррель осудил массированные обстрелы гражданских объектов в донбассе	335074	(?=.*).*	(донбасс)	(обстрел|всу|наци)
14 February 2022	True	cnn  журналисты cnn и afp попали под обстрел в донбассе	335076	(?=.*).*	(донбасс)	(обстрел|всу|наци)
14 February 2022	True	ск россии возбудил уголовные дела о запрещенных методах войны после гибели людей под обстрелом в донбассе	327685	(?=.*).*	(донбасс)	(обстрел|всу|наци)
21 February 2022	True	дмитрий песков   о беженцах с донбасса  люди вынуждены покидать родные дома из за провокаций всу	328721	(?=.*).*	(донбасс)	(обстрел|всу|наци)
21 February 2022	True	песков заявил  что эвакуация жителей донбасса в россию вызвана агрессией всу в регионе	327267	(?=.*).*	(донбасс)	(обстрел|всу|наци)
21 February 2022	True	группа журналистов попала под обстрел в донбассе	330418	(?=.*).*	(донбасс)	(обстрел|всу|наци)
21 February 2022	True	в днр заявили  что всу впервые с      года обстреляли донбасс из систем  град	330275	(?=.*).*	(донбасс)	(обстрел|всу|наци)
21 February 2022	True	захарова объяснила начало военной операции на украине увеличением обстрелов донбасса	330050	(?=.*).*	(донбасс)	(обстрел|всу|наци)
21 February 2022	True	выпускают снаряды по мирным жителям   украинские всу продолжают бомбить мирные города донбасса	327244	(?=.*).*	(донбасс)	(обстрел|всу|наци)
4 April 2022	True	украинские националисты подожгли корабль  донбасс  в порту мариуполя	135338	(?=.*).*	(донбасс)	(обстрел|всу|наци)
23 May 2022	True	скр возбудил более тысячи уголовных дел о преступлениях украинских нацистов в донбассе	427194	(?=.*).*	(донбасс)	(обстрел|всу|наци)
23 May 2022	True	события в донбассе на          мая  отступающие бойцы всу подорвали два моста  завершилась зачистка новоселовки	429677	(?=.*).*	(донбасс)	(обстрел|всу|наци)
23 May 2022	True	эксклюзив фан  всу используют в донбассе иностранные мины parm модификации dm	426959	(?=.*).*	(донбасс)	(обстрел|всу|наци)
23 May 2022	True	события в донбассе на          мая  под бахмутом уничтожен передовой пункт управления всу  в сватово    жителя ранены из за удара  точкой у	427004	(?=.*).*	(донбасс)	(обстрел|всу|наци)
23 May 2022	True	события в донбассе на          мая  вс рф уничтожают склады всу  жители макеевки погибли при украинских обстрелах	424807	(?=.*).*	(донбасс)	(обстрел|всу|наци)
30 May 2022	True	события в донбассе на          мая  всу бьют  смерчами  по днр  бои в северодонецке	433490	(?=.*).*	(донбасс)	(обстрел|всу|наци)
30 May 2022	True	события в донбассе на          мая  в мариуполе задержаны  заблудившиеся  националисты  всу создают  живой щит  в северодонецке	439287	(?=.*).*	(донбасс)	(обстрел|всу|наци)
30 May 2022	True	политолог безпалько  россия возвращает мир на освобожденные от всу территории донбасса	431423	(?=.*).*	(донбасс)	(обстрел|всу|наци)
30 May 2022	True	капитан дандыкин  затопленный в мариуполе корабль  донбасс  хранит тайны всу	429265	(?=.*).*	(донбасс)	(обстрел|всу|наци)
30 May 2022	True	военный эксперт леонков  всу смогут обороняться в донбассе не больше нескольких недель	429279	(?=.*).*	(донбасс)	(обстрел|всу|наци)
30 May 2022	True	события в донбассе на         июня  днр готовится открыть посольство в россии  всу выбиты из яровой	426154	(?=.*).*	(донбасс)	(обстрел|всу|наци)
30 May 2022	True	татарский о стягивании сил всу в бахмут  взятие города приблизит освобождение донбасса	426325	(?=.*).*	(донбасс)	(обстрел|всу|наци)
30 May 2022	True	канадский журналист хаэр  подразделения всу несут колоссальные потери в донбассе	439072	(?=.*).*	(донбасс)	(обстрел|всу|наци)
30 May 2022	True	всу стягивают все силы в бахмут перед решающим сражением за донбасс	436080	(?=.*).*	(донбасс)	(обстрел|всу|наци)
30 May 2022	True	что произошло на украине   июня  принудительный набор в тероборону в харькове  деморализация группировки всу в донбассе	438586	(?=.*).*	(донбасс)	(обстрел|всу|наци)
30 May 2022	True	события в донбассе на         июня  всу захватили офис оон в краматорске  борьба за трассу бахмут   лисичанск	431182	(?=.*).*	(донбасс)	(обстрел|всу|наци)
