24 January 2022	True	киев готовит фейки об обстрелах на донбассе  снимая разрушения      года   последние новости  россии  украины  сирии и мира  новости новороссии  лнр  днр	17970	(?=.*).*	(донбасс)	(обстрел|всу|наци)
31 January 2022	True	всушник выстрелил из автомата себе в ногу  чтобы не участвовать в боевых действиях на донбассе   последние новости  россии  украины  сирии и мира  новости новороссии  лнр  днр	14069	(?=.*).*	(донбасс)	(обстрел|всу|наци)
31 January 2022	True	эксперт по снг евсеев  всу не смогут совершить серьезные провокации против донбасса   последние новости  россии  украины  сирии и мира  новости новороссии  лнр  днр	22883	(?=.*).*	(донбасс)	(обстрел|всу|наци)
31 January 2022	True	всу обучают ведению боя на донбассе в городской местности   последние новости  россии  украины  сирии и мира  новости новороссии  лнр  днр	16646	(?=.*).*	(донбасс)	(обстрел|всу|наци)
7 February 2022	True	всу стягивают в донбасс технику для разминирования  киев готовит проход для бронетехники   последние новости  россии  украины  сирии и мира  новости новороссии  лнр  днр	15474	(?=.*).*	(донбасс)	(обстрел|всу|наци)
7 February 2022	True	в донбасс прибывают новые подразделения всу   последние новости  россии  украины  сирии и мира  новости новороссии  лнр  днр	16443	(?=.*).*	(донбасс)	(обстрел|всу|наци)
7 February 2022	True	всу готовят теракт  в котором хотят обвинить республики донбасса   последние новости  россии  украины  сирии и мира  новости новороссии  лнр  днр	13093	(?=.*).*	(донбасс)	(обстрел|всу|наци)
14 February 2022	True	украина обстреливает донбасс  нарушая бессрочный режим прекращения огня   последние новости  россии  украины  сирии и мира  новости новороссии  лнр  днр	44865	(?=.*).*	(донбасс)	(обстрел|всу|наци)
14 February 2022	True	командование всу перебрасывает тыловиков в донбасс   последние новости  россии  украины  сирии и мира  новости новороссии  лнр  днр	43158	(?=.*).*	(донбасс)	(обстрел|всу|наци)
14 February 2022	True	за последние несколько часов украинские каратели    раз обстреляли территорию донбасса   последние новости  россии  украины  сирии и мира  новости новороссии  лнр  днр	41360	(?=.*).*	(донбасс)	(обстрел|всу|наци)
21 February 2022	True	украинские боевики обстреляли донбасс с применением     мм артиллерии   последние новости  россии  украины  сирии и мира  новости новороссии  лнр  днр	36392	(?=.*).*	(донбасс)	(обстрел|всу|наци)
21 February 2022	True	украинские боевики обстреляли донбасс с применением     мм артиллерии   последние новости  россии  украины  сирии и мира  новости новороссии  лнр  днр	36414	(?=.*).*	(донбасс)	(обстрел|всу|наци)
14 February 2022	True	обстрел детского сада и перекрытие трассы в днр  что известно про обострение в донбассе к    февраля	496834	(?=.*).*	(донбасс)	(обстрел|всу|наци)
14 February 2022	True	депутаты  журналисты и глава мвд украины попали под обстрел в донбассе	496690	(?=.*).*	(донбасс)	(обстрел|всу|наци)
14 February 2022	True	ес осудил обстрелы на донбассе  но назвал сдержанной реакцию киева на провокации	498321	(?=.*).*	(донбасс)	(обстрел|всу|наци)
14 March 2022	True	путин напомнил макрону о военных преступлениях нацистов в донбассе	495874	(?=.*).*	(донбасс)	(обстрел|всу|наци)
14 March 2022	True	путин напомнил макрону о военных преступлениях украинских нацистов в донбассе	498087	(?=.*).*	(донбасс)	(обстрел|всу|наци)
17 January 2022	True	замглавы управления нм днр басурин  всу перебрасывает в донбасс рсзо  смерч  и  ураган	462028	(?=.*).*	(донбасс)	(обстрел|всу|наци)
24 January 2022	True	разведка днр получила сведения о переброске в донбасс механизированных бригад всу	467334	(?=.*).*	(донбасс)	(обстрел|всу|наци)
24 January 2022	True	народная милиция днр  всу перебросили в донбасс рсзо и танки для формирования ударных групп	472568	(?=.*).*	(донбасс)	(обстрел|всу|наци)
24 January 2022	True	народная милиция лнр  всу начнут наступление на донбасс в ближайшие дни	465431	(?=.*).*	(донбасс)	(обстрел|всу|наци)
31 January 2022	True	представитель днр басурин оценил группировку всу в донбассе в     тысяч человек	464766	(?=.*).*	(донбасс)	(обстрел|всу|наци)
7 February 2022	True	глава днр пушилин  в случае наступления всу на донбасс россия может оказать помощь	469062	(?=.*).*	(донбасс)	(обстрел|всу|наци)
14 February 2022	True	скр возбудил дело после обнаружения захоронений погибших при обстрелах мирных жителей донбасса	466458	(?=.*).*	(донбасс)	(обстрел|всу|наци)
14 February 2022	True	в лнр связали приезд зеленского в мариуполь с обстрелами донбасса	465520	(?=.*).*	(донбасс)	(обстрел|всу|наци)
14 February 2022	True	войска днр открыли ответный огонь по украинским силовикам из за обстрела донбасса	464899	(?=.*).*	(донбасс)	(обстрел|всу|наци)
14 February 2022	True	разведка днр раскрыла  план наступления  всу в донбассе	464391	(?=.*).*	(донбасс)	(обстрел|всу|наци)
14 February 2022	True	журналисты cnn и afp во время сопровождения главы мвд попали под обстрел в донбассе	469873	(?=.*).*	(донбасс)	(обстрел|всу|наци)
21 February 2022	True	путин призвал всу сложить оружие после начала военной спецоперации в донбассе	467486	(?=.*).*	(донбасс)	(обстрел|всу|наци)
28 February 2022	True	депутат госдумы шеремет  путин опередил вторжение всу в донбасс на сутки	467093	(?=.*).*	(донбасс)	(обстрел|всу|наци)
28 February 2022	True	националисты отступают  круша советское наследие донбасса	329965	(?=.*).*	(донбасс)	(обстрел|всу|наци)
28 February 2022	True	следственный комитет россии проверит информацию о подготовке украинскими националистами атаки на крым и донбасс	326305	(?=.*).*	(донбасс)	(обстрел|всу|наци)
7 March 2022	True	беженцы из донбасса не любят говорить об обстрелах   за линией фронта остались родственники	329395	(?=.*).*	(донбасс)	(обстрел|всу|наци)
14 March 2022	True	ск россии  обстрелы донбасса участились	330292	(?=.*).*	(донбасс)	(обстрел|всу|наци)
21 March 2022	True	омбудсмен днр заявила  что националисты пытали людей в донбассе	334725	(?=.*).*	(донбасс)	(обстрел|всу|наци)
21 March 2022	True	минобороны  спецоперация россии спасла жителей донбасса от нападения неонацистов	326006	(?=.*).*	(донбасс)	(обстрел|всу|наци)
21 March 2022	True	ск издаст  белую книгу  со свидетельствами преступлений украинских националистов в донбассе	324987	(?=.*).*	(донбасс)	(обстрел|всу|наци)
21 March 2022	True	в минобороны россии заявили о перехвате январского приказа всу о наступлении в донбассе	326267	(?=.*).*	(донбасс)	(обстрел|всу|наци)
28 March 2022	True	последние новости о ситуации вокруг украины на    марта      года  по россии зачищали украинских неонацистов  десятки артистов стремятся на донбасс  в крыму прижмут олигархов	324006	(?=.*).*	(донбасс)	(обстрел|всу|наци)
4 April 2022	True	ск россии возбудил дела после массированных обстрелов донбасса в апреле	332842	(?=.*).*	(донбасс)	(обстрел|всу|наци)
11 April 2022	True	ск россии возбудил дело против главы  грузинского национального легиона  за обстрел донбасса	333856	(?=.*).*	(донбасс)	(обстрел|всу|наци)
11 April 2022	True	ск россии показал    командиров всу  получивших обвинения в геноциде в донбассе	332852	(?=.*).*	(донбасс)	(обстрел|всу|наци)
11 April 2022	True	минобороны  авиация разбомбила на донбассе более     мест сосредоточения украинских националистов	335308	(?=.*).*	(донбасс)	(обстрел|всу|наци)
18 April 2022	True	минобороны  за день на донбассе уничтожено     украинских националистов	336619	(?=.*).*	(донбасс)	(обстрел|всу|наци)
18 April 2022	True	что рассказывают сдавшиеся в плен всушники в донбасской больнице	337408	(?=.*).*	(донбасс)	(обстрел|всу|наци)
18 April 2022	True	волонтёр андрей лысенко   о пасхе в донбассе   люди идут в церковь и отмечают праздник  несмотря на обстрелы  несмотря ни на что	335508	(?=.*).*	(донбасс)	(обстрел|всу|наци)
25 April 2022	True	ск россии возбудил дело против заместителя командира бригады всу за обстрел донбасса	339421	(?=.*).*	(донбасс)	(обстрел|всу|наци)
25 April 2022	True	ск россии установил причастность еще шести украинских командиров к обстрелам донбасса	335342	(?=.*).*	(донбасс)	(обстрел|всу|наци)
2 May 2022	True	экс боевик всу рассказал о докторе  айдара   который в      году убивал раненных ополченцев в донбассе	336693	(?=.*).*	(донбасс)	(обстрел|всу|наци)
2 May 2022	True	ск рф расследует провокации украинских националистов в донбассе	338151	(?=.*).*	(донбасс)	(обстрел|всу|наци)
23 May 2022	True	минобороны россии  высокоточными ракетами в донбассе поражены шесть складов и более     украинских националистов	339305	(?=.*).*	(донбасс)	(обстрел|всу|наци)
30 May 2022	True	черноморский флот оценит возможность подъема затопленного украинскими националистами корабля  донбасс	338613	(?=.*).*	(донбасс)	(обстрел|всу|наци)
30 May 2022	True	минобороны  за сутки в донбассе ликвидировано более     украинских националистов	336338	(?=.*).*	(донбасс)	(обстрел|всу|наци)
30 May 2022	True	военный эксперт дандыкин сообщил  что поднятие корабля  донбасс  позволит раскрыть тайны всу	337472	(?=.*).*	(донбасс)	(обстрел|всу|наци)
24 January 2022	True	днр предлагает всу отказаться от участия в боевых действиях в донбассе  чтобы сохранить свои жизни   последние новости  россии  украины  сирии и мира  новости новороссии  лнр  днр	60756	(?=.*).*	(донбасс)	(обстрел|всу|наци)
24 January 2022	True	офицеры всу пытаются сорвать наступление в донбассе  поскольку не верят в его успех   последние новости  россии  украины  сирии и мира  новости новороссии  лнр  днр	60844	(?=.*).*	(донбасс)	(обстрел|всу|наци)
24 January 2022	True	всу пытались сорвать работу обсе в районе двух сел в донбассе   последние новости  россии  украины  сирии и мира  новости новороссии  лнр  днр	60749	(?=.*).*	(донбасс)	(обстрел|всу|наци)
14 February 2022	True	киев подготовил к отправке в донбасс подразделение всу с американскими пзрк stinger   последние новости  россии  украины  сирии и мира  новости новороссии  лнр  днр	47862	(?=.*).*	(донбасс)	(обстрел|всу|наци)
14 February 2022	True	двое солдат нацистов убили двух жителей донбасса греческого происхождения   последние новости  россии  украины  сирии и мира  новости новороссии  лнр  днр	52292	(?=.*).*	(донбасс)	(обстрел|всу|наци)
21 February 2022	True	командование всу обеспечило боевикам возможность заниматься мародерством в донбассе   последние новости  россии  украины  сирии и мира  новости новороссии  лнр  днр	49907	(?=.*).*	(донбасс)	(обстрел|всу|наци)
21 February 2022	True	всу стягивают в донбасс зрк  оса    последние новости  россии  украины  сирии и мира  новости новороссии  лнр  днр	53667	(?=.*).*	(донбасс)	(обстрел|всу|наци)
27 December 2021	True	взгляд   всу разместили бронетехнику у домов на линии соприкосновения в донбассе    новости дня	171624	(?=.*).*	(донбасс)	(обстрел|всу|наци)
18 July 2022	True	события на украине к          июля  всу ударили по херсону из himars  боевики теробороны отказываются ехать в донбасс	436899	(?=.*).*	(донбасс)	(обстрел|всу|наци)
18 July 2022	True	отношение как к  вражескому мирняку   марков раскрыл новую тактику всу в донбассе	436960	(?=.*).*	(донбасс)	(обстрел|всу|наци)
18 July 2022	True	события в донбассе на          июля  лнр готовится к референдуму  всу выбиты из южной части покровского	430211	(?=.*).*	(донбасс)	(обстрел|всу|наци)
18 July 2022	True	события в донбассе на          июля  лнр готовится референдуму  всу выбиты из южной части покровского	428023	(?=.*).*	(донбасс)	(обстрел|всу|наци)
18 July 2022	True	события в донбассе на          июля  в лнр оценили последствия обстрела красного луча  всу понесли крупные потери в днр	431207	(?=.*).*	(донбасс)	(обстрел|всу|наци)
18 July 2022	True	генштаб всу снова перенес сроки  освобождения  крыма и донбасса	431350	(?=.*).*	(донбасс)	(обстрел|всу|наци)
25 July 2022	True	события в донбассе на          июля  ликвидация наемников в константиновке  в днр сообщили о растущих потерях всу	434029	(?=.*).*	(донбасс)	(обстрел|всу|наци)
25 July 2022	True	события в донбассе на          июля  ликвидация польских наемников  расследование обстрелов донецка	435260	(?=.*).*	(донбасс)	(обстрел|всу|наци)
25 July 2022	True	политолог корнилов  обстрелы всу полей пшеницы не повлияют на продуктовую безопасность донбасса	436801	(?=.*).*	(донбасс)	(обстрел|всу|наци)
25 July 2022	True	события в донбассе на          июля  ликвидация роты бойцов всу в бахмуте  первый регулярный паром в мариуполь	438421	(?=.*).*	(донбасс)	(обстрел|всу|наци)
25 July 2022	True	события в донбассе на          июля  всу забросали донецк  лепестками   киев отправил в зону сво военных психологов	433796	(?=.*).*	(донбасс)	(обстрел|всу|наци)
25 July 2022	True	события в донбассе на          июля  всу ударили  точкой у  по сватово  разработан план восстановления мариуполя	438000	(?=.*).*	(донбасс)	(обстрел|всу|наци)
25 April 2022	True	ск рф нашел еще шестерых украинцев  причастных к обстрелам донбасса   москва	447508	(?=.*).*	(донбасс)	(обстрел|всу|наци)
23 May 2022	True	ситуация в донбассе  сбитый украинский су    и обстрелы населенных пунктов   москва	447795	(?=.*).*	(донбасс)	(обстрел|всу|наци)
30 May 2022	True	артист евгений миронов привез в донбасс театр наций   москва	448044	(?=.*).*	(донбасс)	(обстрел|всу|наци)
20 June 2022	True	обстрел донбасса  британский спецназ на украине  желание шольца и макрона помириться с россией  главное на сегодня   украина	448971	(?=.*).*	(донбасс)	(обстрел|всу|наци)
20 June 2022	True	верховная рада скрыла фото убитой всу жительницы донбасса в своем аккаунте   москва	448277	(?=.*).*	(донбасс)	(обстрел|всу|наци)
18 July 2022	True	народная милиция днр считает возможным применение всу химоружия в донбассе	229504	(?=.*).*	(донбасс)	(обстрел|всу|наци)
18 July 2022	True	в донбассе погибли два американца  воевавших на стороне всу	228826	(?=.*).*	(донбасс)	(обстрел|всу|наци)
20 December 2021	True	донбасс сегодня  киев отправляет срочников воевать  десантники всу убили сослуживца	436999	(?=.*).*	(донбасс)	(обстрел|всу|наци)
27 December 2021	True	норкин рассмешил зрителей до слез анекдотом о генерале всу  крыме и донбассе	420014	(?=.*).*	(донбасс)	(обстрел|всу|наци)
27 December 2021	True	донбасс сегодня  киев окружает республики спецназом  солдаты всу разбегаются по домам	418487	(?=.*).*	(донбасс)	(обстрел|всу|наци)
27 December 2021	True	нардеп волошин отвел всу   минут до поражения в случае наступления в донбассе	437504	(?=.*).*	(донбасс)	(обстрел|всу|наци)
27 December 2021	True	бойцы всу заняли здание школы в селе валуйское в донбассе	418334	(?=.*).*	(донбасс)	(обстрел|всу|наци)
3 January 2022	True	донбасс сегодня  всу блокируют работу обсе  армию киева захлестнули пьянство и конфликты	413117	(?=.*).*	(донбасс)	(обстрел|всу|наци)
3 January 2022	True	донбасс сегодня  дшв украины несут потери  местные жители дают отпор десантникам всу	414803	(?=.*).*	(донбасс)	(обстрел|всу|наци)
3 January 2022	True	донбасс сегодня  солдаты всу потеряли секретные документы  под донецком замечены  правосеки	411409	(?=.*).*	(донбасс)	(обстрел|всу|наци)
3 January 2022	True	донбасс сегодня  всу потеряли    солдат за неделю  сбу терроризирует местных жителей	411868	(?=.*).*	(донбасс)	(обстрел|всу|наци)
3 January 2022	True	донбасс сегодня  солдаты всу подорвались на позициях  морпехи дезертируют с передовых	411660	(?=.*).*	(донбасс)	(обстрел|всу|наци)
3 January 2022	True	всу попытались заглушить беспилотник обсе у линии соприкосновения в донбассе	410599	(?=.*).*	(донбасс)	(обстрел|всу|наци)
10 January 2022	True	донбасс сегодня  резкое обострение на фронте  генштаб всу санкционировал удары по днр и лнр	409312	(?=.*).*	(донбасс)	(обстрел|всу|наци)
10 January 2022	True	донбасс сегодня  лнр несет потери  солдат всу сбил на автомобиле пенсионера	403379	(?=.*).*	(донбасс)	(обстрел|всу|наци)
10 January 2022	True	донбасс сегодня  лнр несет потери  солдат всу сбил на автомобиле пенсионера из днр	404159	(?=.*).*	(донбасс)	(обстрел|всу|наци)
10 January 2022	True	бойцы всу обстреляли из гранатомета село веденское в донбассе	411779	(?=.*).*	(донбасс)	(обстрел|всу|наци)
10 January 2022	True	народная милиция лнр  военнослужащий всу подорвался на собственной мине в донбассе	409854	(?=.*).*	(донбасс)	(обстрел|всу|наци)
