7 February 2022	lenta.ru	https://lenta.ru/news/2022/02/12/vucic/	сербия начала закупать продовольствие и нефтепродукты из за украины	True	290139	(?=.*).*	(серб)	()
14 February 2022	lenta.ru	https://lenta.ru/news/2022/02/16/serbia_gaz/	сша призвали сербию найти альтернативу российскому газу	True	279811	(?=.*).*	(серб)	()
21 February 2022	lenta.ru	https://lenta.ru/news/2022/02/22/vuchich/	сербия заявила об изменении миропорядка после решения путина признать днр и лнр	True	280049	(?=.*).*	(серб)	()
21 February 2022	lenta.ru	https://lenta.ru/news/2022/02/23/bratushki/	сербия отказалась занимать сторону россии в конфликте с украиной	True	279522	(?=.*).*	(серб)	()
21 February 2022	lenta.ru	https://lenta.ru/news/2022/02/23/dnrlnr2/	сербия назвала украине условие для осуждения признания днр и лнр	True	279472	(?=.*).*	(серб)	()
21 February 2022	lenta.ru	https://lenta.ru/news/2022/02/23/nato_/	бывший посол сербии рассказал о желании нато  задушить  россию	True	278394	(?=.*).*	(серб)	()
21 February 2022	lenta.ru	https://lenta.ru/news/2022/02/25/serbia_strong_remove_sanctions/	сербия отказалась вводить санкции против россии	True	278258	(?=.*).*	(серб)	()
28 March 2022	lenta.ru	https://lenta.ru/news/2022/04/04/otnosheniya/	вучич заявил о желании сербии сохранить дружеские отношения с россией	True	277040	(?=.*).*	(серб)	()
4 April 2022	lenta.ru	https://lenta.ru/news/2022/04/04/vuchich_victory/	вучич и его партия победили на выборах в сербии	True	280796	(?=.*).*	(серб)	()
4 April 2022	lenta.ru	https://lenta.ru/news/2022/04/04/zrvena_zvezda/	сербская  црвена звезда  объяснила отказ участвовать в акции с флагом украины	True	279758	(?=.*).*	(серб)	()
4 April 2022	lenta.ru	https://lenta.ru/news/2022/04/07/vucic/	вучич объяснил голосование сербии за выход россии из спч оон	True	280478	(?=.*).*	(серб)	()
4 April 2022	lenta.ru	https://lenta.ru/news/2022/04/08/blackmail/	вучич заявил о шантаже сербии при голосовании за выход россии из спч оон	True	281114	(?=.*).*	(серб)	()
4 April 2022	lenta.ru	https://lenta.ru/news/2022/04/08/oskorbleniya/	президент сербии высказался об оскорблениях в адрес путина	True	281112	(?=.*).*	(серб)	()
4 April 2022	lenta.ru	https://lenta.ru/news/2022/04/10/776868/	сербия рассказала о долгих переговорах о покупке истребителей с францией	True	283231	(?=.*).*	(серб)	()
11 April 2022	lenta.ru	https://lenta.ru/news/2022/04/13/pokupka/	стало известно о покупке сербией зрк fk   для защиты страны	True	283739	(?=.*).*	(серб)	()
11 April 2022	lenta.ru	https://lenta.ru/news/2022/04/15/gas/	сербия снизит газовую зависимость от россии	True	277069	(?=.*).*	(серб)	()
11 April 2022	lenta.ru	https://lenta.ru/news/2022/04/17/gaz_serbia/	вучич рассказал об экономических последствиях конфликта на украине для сербии	True	276712	(?=.*).*	(серб)	()
11 April 2022	lenta.ru	https://lenta.ru/news/2022/04/17/nagrada_sanc/	в сербии рассказали о награде от запада в случае поддержки санкций против россии	True	284616	(?=.*).*	(серб)	()
18 April 2022	lenta.ru	https://lenta.ru/news/2022/04/18/planes/	вучич обвинил украину в сигналах о минировании сербских самолетов	True	286775	(?=.*).*	(серб)	()
18 April 2022	lenta.ru	https://lenta.ru/news/2022/04/21/alexvulin_speaksup/	в сербии захотели пересмотреть планы по интеграции в ес	True	291452	(?=.*).*	(серб)	()
25 April 2022	lenta.ru	https://lenta.ru/news/2022/04/30/vucic/	президент сербии раскрыл свое отношение к санкциям против россии	True	281442	(?=.*).*	(серб)	()
10 January 2022	runews24.ru	https://runews24.ru/politics/13/01/2022/e89c0522f0e9fe1ab9f4063f1cd29892	вучич  экологические протесты в сербии спонсируются западом	True	467621	(?=.*).*	(серб)	()
10 January 2022	runews24.ru	https://runews24.ru/world/14/01/2022/de3fac5416b8a3a86ab4ff0ca45bc7bf	сербские власти назвали подлинным документ о положительном тесте джоковича на ковид	True	462042	(?=.*).*	(серб)	()
10 January 2022	runews24.ru	https://runews24.ru:443/world/14/01/2022/fb5cbf7a951ff1f66d6a029f25944aa0	сербский президент вучич заявил о намерении бороться за джоковича	True	462040	(?=.*).*	(серб)	()
17 January 2022	runews24.ru	https://runews24.ru/world/17/01/2022/a4482ed2439428bbca67c08ce3a5e9fa	более     участвовавших в референдуме сербов поддержали изменения в конституции	True	464593	(?=.*).*	(серб)	()
17 January 2022	runews24.ru	https://runews24.ru/world/21/01/2022/40c530326c1e7396da7ac090ef5900e9	глава мвд сербии вулин  на президента вучича готовится покушение	True	461910	(?=.*).*	(серб)	()
14 February 2022	runews24.ru	https://runews24.ru:443/world/16/02/2022/ecf295ad8624d61d9e351a0360501d2b	сербский президент александр вучич назначил досрочные парламентские выборы на   апреля	True	467925	(?=.*).*	(серб)	()
14 February 2022	runews24.ru	https://runews24.ru/world/19/02/2022/af829247e442a50f40b0b88280311a65	президент сербии вучич заявил о ничтожной вероятности присоединения страны к нато	True	464185	(?=.*).*	(серб)	()
21 February 2022	runews24.ru	https://runews24.ru/world/22/02/2022/1ad84b7c98fdb317420ef603f568df6a	вучич  политическое давление на сербию возрастет после решения путина признать днр и лнр	True	465061	(?=.*).*	(серб)	()
21 February 2022	runews24.ru	https://runews24.ru:443/world/23/02/2022/ef69abecc30b43a01e2e38db1d45f0b9	президент сербии жестко ответил на высказывание посла украины в белграде	True	465379	(?=.*).*	(серб)	()
28 February 2022	runews24.ru	https://runews24.ru:443/politics/06/03/2022/7f1de2s6052e6ba565f945ad121bc1eb	президент сербии  кризис на украине приведёт к тектоническим проблемам в мировой экономике	True	464550	(?=.*).*	(серб)	()
28 February 2022	runews24.ru	https://runews24.ru:443/world/06/03/2022/4b00dc8829d7978678cf55e6e242c98a	президент сербии вучич оправдался за поддержку антироссийской резолюции в оон	True	465425	(?=.*).*	(серб)	()
7 March 2022	runews24.ru	https://runews24.ru/politics/13/03/2022/dbb6632cada1658ed3cdcb7ea6b5ece5	вучич заявил  что сербия сократит число авиарейсов в рф из за давления запада	True	463444	(?=.*).*	(серб)	()
7 March 2022	runews24.ru	https://runews24.ru:443/politics/13/03/2022/f755ff1af9c60165d813785935f82dd1	президент сербии вучич заявил о согласии платить      за тысячу кубометров газа из россии	True	462720	(?=.*).*	(серб)	()
17 January 2022	kommersant.ru	https://www.kommersant.ru/doc/5180459	власти сербии сообщили  что черногорская мафия готовит покушение на вучича	True	511648	(?=.*).*	(серб)	()
31 January 2022	kommersant.ru	https://www.kommersant.ru/doc/5195482	вопрос поставлен сербом	True	509652	(?=.*).*	(серб)	()
14 February 2022	kommersant.ru	https://www.kommersant.ru/doc/5216227	сербия рекомендовала гражданам покинуть украину	True	517942	(?=.*).*	(серб)	()
14 February 2022	kommersant.ru	https://www.kommersant.ru/doc/5217449	президент сербии назначил досрочные парламентские выборы на   апреля	True	510947	(?=.*).*	(серб)	()
21 February 2022	kommersant.ru	https://www.kommersant.ru/doc/5228789	вучич  сербия поддерживает целостность украины  но     населения на стороне россии	True	511098	(?=.*).*	(серб)	()
21 February 2022	kommersant.ru	https://www.kommersant.ru/doc/5236709	сербия отказалась вводить санкции против россии	True	512790	(?=.*).*	(серб)	()
28 February 2022	kommersant.ru	https://www.kommersant.ru/doc/5249345	вучич назвал безответственным участие в акциях в поддержку россии или украины в сербии	True	509505	(?=.*).*	(серб)	()
28 February 2022	kommersant.ru	https://www.kommersant.ru:443/doc/5249447	в сербии вучича выдвинули на второй президентский срок	True	509661	(?=.*).*	(серб)	()
7 March 2022	kommersant.ru	https://www.kommersant.ru/doc/5250424	для президента сербии главное   маневры	True	508521	(?=.*).*	(серб)	()
7 March 2022	kommersant.ru	https://www.kommersant.ru/doc/5252239	вучич  сербия не вступит в нато  бомбардировки      году были агрессией	True	509590	(?=.*).*	(серб)	()
7 March 2022	kommersant.ru	https://www.kommersant.ru/doc/5252322	президент сербии считает кризис в европе самым тяжелым со второй мировой войны	True	509319	(?=.*).*	(серб)	()
14 March 2022	kommersant.ru	https://www.kommersant.ru/doc/5269370	вучич сообщил о запрете импорта в сербию нефти из за санкций ес против россии	True	513700	(?=.*).*	(серб)	()
28 February 2022	pda.kp.ru	https://pda.kp.ru/daily/27373/4554105/	в сербии проходят массовые демонстрации в поддержку россии	True	332267	(?=.*).*	(серб)	()
28 February 2022	pda.kp.ru	https://pda.kp.ru/daily/27373/4554444/	тысяч сербов вышли на митинг с портретами путина	True	328344	(?=.*).*	(серб)	()
28 February 2022	pda.kp.ru	https://pda.kp.ru/online/news/4654703/	президент сербии вучич предрек изменения мировой экономики из за ситуации на украине	True	326252	(?=.*).*	(серб)	()
28 February 2022	pda.kp.ru	https://pda.kp.ru/online/news/4654803/	президент сербии объяснил поддержку резолюции оон внешним давлением	True	326957	(?=.*).*	(серб)	()
7 March 2022	pda.kp.ru	https://pda.kp.ru/online/news/4656875/	вучич сообщил о готовности сербии отменить таможенные пошлины на нефть из третьих стран	True	325633	(?=.*).*	(серб)	()
7 March 2022	pda.kp.ru	https://pda.kp.ru/online/news/4662345/	вучич заявил  что сербия не станет вступать в нато	True	327077	(?=.*).*	(серб)	()
7 March 2022	pda.kp.ru	https://pda.kp.ru/daily/27375.5/4557535/	президент сербии рассказал о внешнем давлении на его страну из за тесных связей с россией	True	326410	(?=.*).*	(серб)	()
7 March 2022	pda.kp.ru	https://pda.kp.ru/online/news/4663089/	в столице сербии    марта проходит акция в поддержку россии	True	325621	(?=.*).*	(серб)	()
14 March 2022	pda.kp.ru	https://pda.kp.ru/online/news/4669357/	глава мвд сербии назвал гонения на россиян на западе возвращением нацизма	True	329383	(?=.*).*	(серб)	()
14 March 2022	pda.kp.ru	https://pda.kp.ru/online/news/4669744/	советник мид сербии  россия использует ошибки нато для создания нового мира	True	324834	(?=.*).*	(серб)	()
14 March 2022	pda.kp.ru	https://pda.kp.ru/online/news/4671175/	президент сербии вучич раскритиковал двойные стандарты запада	True	333449	(?=.*).*	(серб)	()
14 March 2022	pda.kp.ru	https://pda.kp.ru/online/news/4671554/	вучич заявил  что сербия получает российский газ  почти бесплатно	True	335229	(?=.*).*	(серб)	()
21 March 2022	pda.kp.ru	https://pda.kp.ru/online/news/4674184/	вучич заявил  что сербия не будет вступать в нато из за памяти о бомбардировках югославии в	True	333308	(?=.*).*	(серб)	()
21 March 2022	pda.kp.ru	https://pda.kp.ru/daily/27370/4562709/	постыдно и глупо   президент сербии дал оценку обвинениям в адрес россии	True	331861	(?=.*).*	(серб)	()
21 March 2022	pda.kp.ru	https://pda.kp.ru/online/news/4677638/	президент сербии назвал  глупыми и постыдными  обвинения запада в адрес москвы	True	330571	(?=.*).*	(серб)	()
21 March 2022	pda.kp.ru	https://pda.kp.ru/online/news/4677924/	вучич заявил о проблемах для сербии из за решения россии об оплате газа рублями	True	331856	(?=.*).*	(серб)	()
21 March 2022	pda.kp.ru	https://pda.kp.ru/online/news/4678519/	песков заявил  что россия постарается решить проблему оплаты газа в рублях для сербии	True	332883	(?=.*).*	(серб)	()
21 March 2022	pda.kp.ru	https://pda.kp.ru/daily/27371.5/4563790/	вучич назвал причины отказа сербии от антироссийских санкций	True	326676	(?=.*).*	(серб)	()
21 March 2022	pda.kp.ru	https://pda.kp.ru/online/news/4681724/	в сербии сообщили о снижении экспорта в россию на фоне санкций	True	326586	(?=.*).*	(серб)	()
28 March 2022	pda.kp.ru	https://pda.kp.ru/online/news/4683146/	лавров заявил  что запад пытается сделать сербию инструментом своей политики	True	331796	(?=.*).*	(серб)	()
28 March 2022	pda.kp.ru	https://pda.kp.ru/online/news/4685598/	оператор трубопровода janaf предупредил о приостановке прокачки нефти в сербию с мая	True	330645	(?=.*).*	(серб)	()
28 March 2022	pda.kp.ru	https://pda.kp.ru/online/news/4687906/	в сербии заявили  что страна не должна вводить санкции против россии из за косово	True	326288	(?=.*).*	(серб)	()
4 April 2022	pda.kp.ru	https://pda.kp.ru/daily/27374/4567660/	друзья путина  уверенно победили на выборах в венгрии и сербии	True	333035	(?=.*).*	(серб)	()
4 April 2022	pda.kp.ru	https://pda.kp.ru/online/news/4692774/	как выборы в сербии и венгрии скажутся на отношениях с россией  оценил академик	True	326046	(?=.*).*	(серб)	()
10 January 2022	ria.ru	https://ria.ru/20220116/serbiya-1768058135.html	в сербии открылись участки на референдуме по изменению конституции	True	214850	(?=.*).*	(серб)	()
17 January 2022	ria.ru	https://ria.ru/20220117/konstitutsiya-1768135282.html	большинство сербов выступили за изменения в конституции	True	205781	(?=.*).*	(серб)	()
17 January 2022	ria.ru	https://ria.ru/20220119/volodin-1768525856.html	володин поговорил по телефону с главой народной скупщины сербии	True	207595	(?=.*).*	(серб)	()
17 January 2022	ria.ru	https://ria.ru/20220121/vuchich-1769002544.html	в сербии заявили о подготовке покушения на вучича	True	206168	(?=.*).*	(серб)	()
31 January 2022	ria.ru	https://ria.ru/20220202/ukraina-1770759187.html	посольство россии в сербии возмутила статья посла сша в приштине об украине	True	208848	(?=.*).*	(серб)	()
31 January 2022	ria.ru	https://ria.ru/20220204/rt-1771134028.html	в мид напомнили германии о сербской лицензии rt de	True	209771	(?=.*).*	(серб)	()
7 February 2022	ria.ru	https://ria.ru/20220208/rezervy-1771701929.html	сербия пополняет резервы продуктов и топлива из за украины  заявил вучич	True	208692	(?=.*).*	(серб)	()
7 February 2022	ria.ru	https://ria.ru/20220209/iski-1771926385.html	в еспч могут направить иски за сброс урановых бомб нато по сербии	True	223255	(?=.*).*	(серб)	()
7 March 2022	spb.kp.ru	https://pda.spb.kp.ru/daily/27370/4552782/	немыслимое предсказание ванги  украина  болгария и сербия войдут в славянский союз с россией к      году	True	22543	(?=.*).*	(серб)	()
27 December 2021	sputnik-georgia.ru	https://sputnik-georgia.ru/20211228/glava-serbskogo-regulyatora-litsenziya-na-veschanie-dlya-rt-de-byla-vydana-v-serbii-zakonno-263220169.html	глава сербского регулятора  лицензия на вещание для rt de была выдана в сербии законно	True	542405	(?=.*).*	(серб)	()
2 May 2022	sputnik-georgia.ru	https://sputnik-georgia.ru/20220505/vuchich-v-1999-godu-zapad-ne-govoril-o-tselostnosti-serbii-266456086.html	вучич  в      году запад не говорил о целостности сербии	True	539746	(?=.*).*	(серб)	()
6 June 2022	lenta.ru	https://lenta.ru/news/2022/06/10/serbia_eu/	шольц назвал условие вступления сербии в ес	True	292421	(?=.*).*	(серб)	()
6 June 2022	lenta.ru	https://lenta.ru/news/2022/06/10/sholtz_serbia/	сербия заявила о требовании шольца ввести санкции против россии	True	291678	(?=.*).*	(серб)	()
6 June 2022	lenta.ru	https://lenta.ru/news/2022/06/11/kosovo/	сербов возмутило требование шольца о присоединении к санкциями против россии	True	285492	(?=.*).*	(серб)	()
13 June 2022	lenta.ru	https://lenta.ru/news/2022/06/13/serbia/	в мид сербии заявили об отказе белграда идти против москвы	True	280914	(?=.*).*	(серб)	()
13 June 2022	lenta.ru	https://lenta.ru/news/2022/06/14/vuchich_on_eu/	в сербии заявили о росте евроскептицизма из за позиции ес по косово	True	275008	(?=.*).*	(серб)	()
13 June 2022	lenta.ru	https://lenta.ru/news/2022/06/15/vuc/	сербия назвала цену российского газа	True	291500	(?=.*).*	(серб)	()
20 June 2022	lenta.ru	https://lenta.ru/news/2022/06/21/vulin_speaksup/	в сербии ответили на призыв еврокомиссии  выбрать сторону	True	293021	(?=.*).*	(серб)	()
20 June 2022	lenta.ru	https://lenta.ru/news/2022/06/25/air_serbia/	россия и сербия будут сотрудничать по повышению безопасности полетов	True	288691	(?=.*).*	(серб)	()
27 June 2022	lenta.ru	https://lenta.ru/news/2022/07/02/pehota/	в сербии отказались становиться  пехотой нато  и конфликтовать с россией	True	284223	(?=.*).*	(серб)	()
4 July 2022	lenta.ru	https://lenta.ru/news/2022/07/06/licemery/	в сербии обвинили европарламент в лицемерии из за косово и украины	True	287693	(?=.*).*	(серб)	()
11 July 2022	lenta.ru	https://lenta.ru/news/2022/07/15/rada_vcc/	депутат рады пообещал перевоспитать сербов после слов вучича о путине	True	287462	(?=.*).*	(серб)	()
11 July 2022	lenta.ru	https://lenta.ru/news/2022/07/15/rada_vcc/	депутат рады пообещал перевоспитать сербов после слов о вучича о путине	True	287463	(?=.*).*	(серб)	()
11 July 2022	lenta.ru	https://lenta.ru/news/2022/07/16/opredelilis/	сербия определилась с позицией нового правительства по россии	True	287980	(?=.*).*	(серб)	()
11 July 2022	lenta.ru	https://lenta.ru/news/2022/07/17/croatia_regime/	сербия ответила хорватии на запрет вучичу посетить место казни тысяч сербов	True	287122	(?=.*).*	(серб)	()
11 July 2022	lenta.ru	https://lenta.ru/news/2022/07/17/nota/	мид сербии направил ноту протеста хорватии из за скандала с вучичем	True	287134	(?=.*).*	(серб)	()
11 July 2022	lenta.ru	https://lenta.ru/news/2022/07/17/samolet/	в греции разбился украинский самолет с сербской оборонной продукцией	True	287094	(?=.*).*	(серб)	()
11 July 2022	lenta.ru	https://lenta.ru/news/2022/07/17/serbiya_horvatiya/	премьер сербии заявила о крупнейшем в новейшей истории скандале с хорватией	True	287090	(?=.*).*	(серб)	()
18 July 2022	lenta.ru	https://lenta.ru/news/2022/07/22/vuchich_z/	вучич прокомментировал фото со знаком z на шлеме сербского военного	True	287293	(?=.*).*	(серб)	()
18 July 2022	lenta.ru	https://lenta.ru/news/2022/07/23/uran_level/	в телах пострадавших от бомбардировок нато сербов выявили высокий уровень урана	True	287103	(?=.*).*	(серб)	()
18 July 2022	lenta.ru	https://lenta.ru/news/2022/07/24/natoserbia/	токсиколог заявил об отравлении силами нато    поколений сербов	True	288862	(?=.*).*	(серб)	()
18 July 2022	lenta.ru	https://lenta.ru/news/2022/07/24/serbiavulin/	глава мвд сербии ответил на угрозы иностранных спецслужб в свой адрес	True	288847	(?=.*).*	(серб)	()
11 July 2022	pravda.ru	https://www.pravda.ru/news/world/1727621-serbija/	на украине пообещали  перевоспитать  сербов	True	351121	(?=.*).*	(серб)	()
11 July 2022	pravda.ru	https://www.pravda.ru/news/world/1727882-serbija_v_rossiju/	если сербия войдёт в россию  не станет украины и румынии   кедми	True	349457	(?=.*).*	(серб)	()
20 December 2021	regnum.ru	https://regnum.ru/news/3462590.html	в сша заявили о схожих целях америки и сербии	True	399228	(?=.*).*	(серб)	()
20 December 2021	regnum.ru	https://regnum.ru/news/economy/3461938.html	вучич попросит у путина для сербии дополнительных объёмов газа	True	386112	(?=.*).*	(серб)	()
20 December 2021	regnum.ru	https://regnum.ru/news/polit/3455027.html	президент сербии обвинил европейских политиков в энергетическом кризисе	True	397814	(?=.*).*	(серб)	()
20 December 2021	regnum.ru	https://regnum.ru/news/polit/3461664.html	лавров рассказал  чем для россии является сербия	True	397813	(?=.*).*	(серб)	()
20 December 2021	regnum.ru	https://regnum.ru/news/polit/3461816.html	сербия получила российские  корнеты	True	397812	(?=.*).*	(серб)	()
27 December 2021	regnum.ru	https://regnum.ru/news/3463460.html	полиция косово инициировала расследование осквернения сербских могил	True	382560	(?=.*).*	(серб)	()
27 December 2021	regnum.ru	https://regnum.ru/news/3463664.html	остаток трассы бар боляре к сербии будет стоить черногории     млн евро	True	382499	(?=.*).*	(серб)	()
