21 February 2022	regnum.ru	https://regnum.ru/news/polit/3518049.html	вучич объяснил  почему сербия не вводит санкции против россии	True	363978	(?=.*).*	(серб)	()
21 February 2022	regnum.ru	https://regnum.ru/news/3518865.html	друг познаётся в беде    сети о позиции сербии насчёт спецоперации россии	True	363859	(?=.*).*	(серб)	()
28 February 2022	regnum.ru	https://regnum.ru/news/polit/3519516.html	сербский юрист действия россии полностью соответствуют международному праву	True	373440	(?=.*).*	(серб)	()
28 February 2022	regnum.ru	https://regnum.ru/news/polit/3519516.html	сербский юрист действия россии полностью соответствуют международному праву	True	373441	(?=.*).*	(серб)	()
28 February 2022	regnum.ru	https://regnum.ru/news/society/3425994.html	в офисе иа regnum пройдёт презентация сборника  косово  сербия и россия	True	372110	(?=.*).*	(серб)	()
28 February 2022	regnum.ru	https://regnum.ru/news/society/3519833.html	сербский омбудсмен пригласил российского и украинского коллег в белград	True	372622	(?=.*).*	(серб)	()
28 February 2022	regnum.ru	https://regnum.ru/news/society/3519833.html	сербский омбудсмен пригласил российского и украинского коллегу в белград	True	372620	(?=.*).*	(серб)	()
28 February 2022	regnum.ru	https://regnum.ru/news/3521136.html	премьер сербии пророчит стране трудные времена из за отношения к россии	True	375865	(?=.*).*	(серб)	()
28 February 2022	regnum.ru	https://regnum.ru/news/3521139.html	дачич  для сербии оптимально сохранить военный нейтралитет	True	375859	(?=.*).*	(серб)	()
28 February 2022	regnum.ru	https://regnum.ru/news/3521139.html	дачич  для сербии оптимально сохранить военный нейтралитет	True	375861	(?=.*).*	(серб)	()
28 February 2022	regnum.ru	https://regnum.ru/news/polit/3520874.html	вучич рассказал о давлении на сербию из за неприсоединения к санкциям	True	373582	(?=.*).*	(серб)	()
28 February 2022	regnum.ru	https://regnum.ru/news/polit/3521899.html	сербский эксперт  на украине россия защищает всю русскую цивилизацию	True	371767	(?=.*).*	(серб)	()
28 February 2022	regnum.ru	https://regnum.ru/news/polit/3521899.html	сербский эксперт  на украине россия защищает всю русскую цивилизацию	True	371769	(?=.*).*	(серб)	()
28 February 2022	regnum.ru	https://regnum.ru/news/3522319.html	сербия проголосовала за антироссийскую резолюцию оон	True	362531	(?=.*).*	(серб)	()
28 February 2022	regnum.ru	https://regnum.ru/news/3523163.html	сербский политик  сербский народ не предавал россию   это сделал вучич	True	363644	(?=.*).*	(серб)	()
28 February 2022	regnum.ru	https://regnum.ru/news/3523568.html	курти  сербия и россия хотят напасть на косово	True	373604	(?=.*).*	(серб)	()
28 February 2022	regnum.ru	https://regnum.ru/news/3523581.html	сербия временно закрыла посольство на украине	True	373601	(?=.*).*	(серб)	()
28 February 2022	regnum.ru	https://regnum.ru/news/polit/3524665.html	интерес сербии в союзничестве с россией  а интерес вучича в подчинении нато	True	369664	(?=.*).*	(серб)	()
11 July 2022	runews24.ru	https://runews24.ru:443/world/14/07/2022/d027fb666d8c4907d582ffd33cb78a49	вучич  сербия продолжит европейский путь и сохранит дружеские отношения с россией и китаем	True	471066	(?=.*).*	(серб)	()
11 July 2022	runews24.ru	https://runews24.ru/politics/15/07/2022/d30fb20c512b75fadf867d9f637f096d	глава мид вулин  последователям бандеры и усташей не изменить сербию	True	474352	(?=.*).*	(серб)	()
11 July 2022	runews24.ru	https://runews24.ru:443/politics/15/07/2022/ebceeb103c3fe446b22de5af86414426	депутат рады гончаренко пообещал перевоспитать сербов при вступлении в евросоюз	True	472327	(?=.*).*	(серб)	()
18 July 2022	runews24.ru	https://runews24.ru/world/22/07/2022/931ec5b3fb2ce611238a7a0bdea5d827	президент вучич объяснил появившееся в сети фото сербского бойца с z на шлеме	True	472710	(?=.*).*	(серб)	()
25 July 2022	runews24.ru	https://runews24.ru/politics/29/07/2022/f818a5e5108aaf0204d8ae150fd4ee49	вучич заявил  что в предстоящие   месяцев сербия будет фактически на чрезвычайном положении	True	468944	(?=.*).*	(серб)	()
24 January 2022	rusplt.ru	https://rusplt.ru/abroad/vlasti-serbii-ekstradirovali-bakhreinskogo-61f03bb.html	власти сербии экстрадировали бахрейнского диссидента в бахрейн в ходе первого теста	True	34454	(?=.*).*	(серб)	()
31 January 2022	rusprav.tv	https://rusprav.tv/serbskij-analitik-rasskazal-o-strategii-gosdepa-v-vojne-protiv-pravoslaviya-124458/	сербский аналитик рассказал о стратегии госдепа в войне против православия	True	15378	(?=.*).*	(серб)	()
9 May 2022	rusprav.tv	https://rusprav.tv/eto-raskol-v-serbii-raskritikovali-priznanie-fanarom-makedonskoj-cerkvi-127121/	это раскол  в сербии раскритиковали признание фанаром македонской церкви	True	4042	(?=.*).*	(серб)	()
2 May 2022	lenta.ru	https://lenta.ru/news/2022/05/04/vuchich/	вучич заявил о твердом курсе сербии в евросоюз	True	276331	(?=.*).*	(серб)	()
2 May 2022	lenta.ru	https://lenta.ru/news/2022/05/05/vucic/	заявление вучича об усложнении позиций сербии из за слов путина объяснили	True	284964	(?=.*).*	(серб)	()
2 May 2022	lenta.ru	https://lenta.ru/news/2022/05/08/dollar/	в сербии предрекли уничтожение доллара	True	277174	(?=.*).*	(серб)	()
9 May 2022	lenta.ru	https://lenta.ru/news/2022/05/09/vuchich/	вучич победил на выборах президента сербии	True	281739	(?=.*).*	(серб)	()
9 May 2022	lenta.ru	https://lenta.ru/news/2022/05/12/sanctions/	в сербии выразили опасение новым санкциям евросоюза против россии	True	277378	(?=.*).*	(серб)	()
9 May 2022	lenta.ru	https://lenta.ru/news/2022/05/15/vuvich/	власти сербии заявили о намерении сопротивляться введению санкций против россии	True	284455	(?=.*).*	(серб)	()
9 May 2022	lenta.ru	https://lenta.ru/news/2022/05/15/westborders/	вучич обвинил запад в перекраивании границ сербии	True	284458	(?=.*).*	(серб)	()
9 May 2022	lenta.ru	https://lenta.ru/news/2022/05/15/zaderjanie/	вучич назвал интересной историю с поляками у оборонного предприятия в сербии	True	284886	(?=.*).*	(серб)	()
16 May 2022	lenta.ru	https://lenta.ru/news/2022/05/17/evo_sta_radi/	сербия захотела снизить зависимость от российского газа	True	291799	(?=.*).*	(серб)	()
23 May 2022	lenta.ru	https://lenta.ru/news/2022/05/25/1999/	нато отказалась нести ответственность за бомбардировки сербии в      м	True	292030	(?=.*).*	(серб)	()
23 May 2022	lenta.ru	https://lenta.ru/news/2022/05/25/gas/	сербия понадеялась на  честную  цену на газ из россии	True	284410	(?=.*).*	(серб)	()
23 May 2022	lenta.ru	https://lenta.ru/news/2022/05/25/hungary/	венгрия поделится газохранилищами с сербией	True	290872	(?=.*).*	(серб)	()
23 May 2022	lenta.ru	https://lenta.ru/news/2022/05/25/impossible/	сербия заявила о невозможности ввести санкции против россии	True	284396	(?=.*).*	(серб)	()
30 May 2022	lenta.ru	https://lenta.ru/news/2022/05/30/serb/	сербия назвала размер платы за российский газ	True	289718	(?=.*).*	(серб)	()
4 April 2022	mk.ru	https://www.mk.ru/politics/2022/04/08/serbiya-zaprosit-rf-i-nato-po-incidentu-s-istrebitelem-i-laynerom.html	сербия опросит рф и нато по инциденту с истребителем и лайнером	True	139112	(?=.*).*	(серб)	()
4 April 2022	mk.ru	https://www.mk.ru/politics/2022/04/08/ekspert-nazval-provokaciey-incident-s-istrebitelem-nato-i-serbskim-samoletom.html	эксперт назвал провокацией инцидент с истребителем нато и сербским самолетом	True	146132	(?=.*).*	(серб)	()
4 April 2022	mk.ru	https://www.mk.ru/politics/2022/04/08/predast-li-vuchich-rossiyu-chem-shantazhiruyut-prezidenta-serbii.html	предаст ли вучич россию  чем шантажируют президента сербии	True	146765	(?=.*).*	(серб)	()
4 April 2022	mk.ru	https://www.mk.ru/politics/army/2022/04/10/serbiya-vedet-peregovory-o-pokupke-istrebiteley-rafale-vuchich.html	сербия ведет переговоры о покупке истребителей rafale   вучич	True	141822	(?=.*).*	(серб)	()
11 April 2022	mk.ru	https://www.mk.ru/politics/2022/04/15/serbiya-zayavila-o-snizhenii-zavisimosti-ot-rf-i-pokupki-spg-iz-grecii.html	сербия заявила о снижении зависимости от рф и покупки спг из греции	True	140380	(?=.*).*	(серб)	()
4 April 2022	neftegaz.ru	https://neftegaz.ru/news/partnership/732815-v-putin-i-a-vuchich-obsudili-kontrakt-na-postavku-rossiyskogo-gaza-v-serbiyu-i-neftyanoy-vopros/	в  путин и а  вучич обсудили контракт на поставку российского газа в сербию и нефтяной вопрос	True	50942	(?=.*).*	(серб)	()
3 January 2022	news-front.info	https://news-front.info/2022/01/06/serbiya-ne-budet-vvodit-sanktsii-protiv-svoih-grazhdan-vuchich/	сербия не будет вводить санкции против своих граждан   вучич   последние новости  россии  украины  сирии и мира  новости новороссии  лнр  днр	True	50278	(?=.*).*	(серб)	()
10 January 2022	news-front.info	https://news-front.info/2022/01/13/ekoprotesty-v-serbii-sponsiruyutsya-zapadom-vuchich/	экопротесты в сербии спонсируются западом   вучич   последние новости  россии  украины  сирии и мира  новости новороссии  лнр  днр	True	63693	(?=.*).*	(серб)	()
24 January 2022	news-front.info	https://news-front.info/2022/01/24/kak-tsru-ustranyaet-neugodnyh-politicheskih-deyateley-gotovitsya-pokushenie-na-prezidenta-serbii/	как цру устраняет неугодных политических деятелей  готовится покушение на президента сербии    последние новости  россии  украины  сирии и мира  новости новороссии  лнр  днр	True	60375	(?=.*).*	(серб)	()
14 February 2022	news-front.info	https://news-front.info/2022/02/15/vuchich-otpravil-serbskiy-parlament-v-otstavku/	вучич отправил сербский парламент в отставку   последние новости  россии  украины  сирии и мира  новости новороссии  лнр  днр	True	45872	(?=.*).*	(серб)	()
28 February 2022	newsler.ru	https://www.newsler.ru/auto/2022/03/01/ne-mog-zaplatit-za-shinomontazh-stoyanku-i-poest-kirovchane-pomogli-serbskomu-voditelyu	не мог заплатить за шиномонтаж  стоянку и поесть   кировчане помогли сербскому водителю	True	64563	(?=.*).*	(серб)	()
14 March 2022	niann.ru	https://www.niann.ru/?id=576409	евгений люлин провел совещание с коллегами из республики сербской	True	51454	(?=.*).*	(серб)	()
21 February 2022	vsesmi.ru	http://www.vsesmi.ru/policy/2022/02/21/3376583/	сербия заявила об изменении миропорядка после решения путина признать днр и лнр	True	49528	(?=.*).*	(серб)	()
10 January 2022	vz.ru	https://vz.ru/news/2022/1/13/1138510.html	взгляд   вучич заявил о западных спонсорах протестов в сербии    новости дня	True	170768	(?=.*).*	(серб)	()
10 January 2022	vz.ru	https://vz.ru/news/2022/1/16/1138989.html	взгляд   в сербии отреагировали на решение о депортации джоковича    новости дня	True	168145	(?=.*).*	(серб)	()
10 January 2022	vz.ru	https://vz.ru/news/2022/1/17/1139036.html	взгляд   граждане сербии поддержали на референдуме изменения в конституции    новости дня	True	168186	(?=.*).*	(серб)	()
6 June 2022	vestikavkaza.ru	https://vestikavkaza.ru/news/glava-mvd-serbii-prokommentiroval-sryv-vizita-lavrova-v-respubliku.html	глава мвд сербии прокомментировал срыв визита лаврова в республику	True	538280	(?=.*).*	(серб)	()
11 July 2022	vestikavkaza.ru	https://vestikavkaza.ru/analytics/serbia-hocet-vremenno-zavladet-neftanoj-kompaniej-bolsaa-cast-kotoroj-prinadlezit-rossii.html	сербия хочет временно завладеть нефтяной компанией  большая часть которой принадлежит россии	True	538625	(?=.*).*	(серб)	()
18 July 2022	vestikavkaza.ru	https://vestikavkaza.ru/news/krasnodar-zaklucil-kontrakt-s-igrokom-sbornoj-serbii.html	краснодар  заключил контракт с игроком сборной сербии	True	538333	(?=.*).*	(серб)	()
17 January 2022	5-tv.ru	https://www.5-tv.ru/news/373179/deportirovannyj-izavstralii-novak-dzokovic-nevysel-kserbskim-poklonnikam/	депортированный из австралии новак джокович не вышел к сербским поклонникам	True	103823	(?=.*).*	(серб)	()
24 January 2022	5-tv.ru	https://www.5-tv.ru/news/374500/futbolisty-alanii-ustroili-massovuu-draku-sserbskoj-komandoj-vpervom-tajme/	фото  российские футболисты устроили драку с командой сербии	True	12680	(?=.*).*	(серб)	()
11 July 2022	5-tv.ru	https://www.5-tv.ru/news/394273/takih-pridurkov-nezamecaem-vserbii-otvetili-naugrozy-deputata-rady-vucicu/	видео  как в сербии ответили на угрозы депутата рады вучичу	True	108481	(?=.*).*	(серб)	()
25 July 2022	5-tv.ru	https://www.5-tv.ru/news/395879/serby-poprosili-pevicu-elenu-karleusi-nepriezzat-nasvoe-vystuplenie/	видео  сербы напрямую попросили не выступать местную певицу	True	104430	(?=.*).*	(серб)	()
27 December 2021	aif.ru	https://aif.ru/health/coronavirus/serbiya_vedet_peregovory_s_rf_o_proizvodstve_sputnika_layt	сербия ведет переговоры с рф о производстве  спутника лайт	True	178457	(?=.*).*	(серб)	()
27 December 2021	aif.ru	https://aif.ru/politics/posolstvo_rf_v_serbii_nazvalo_vysylku_sotrudnika_oon_iz_kosovo_provokaciey	посольство рф в сербии назвало высылку сотрудника оон из косово провокацией	True	178124	(?=.*).*	(серб)	()
10 January 2022	gazeta.ru	https://www.gazeta.ru/politics/news/2022/01/13/17132557.shtml	вучич обвинил запад в спонсировании протестов в сербии   газета ru	True	310395	(?=.*).*	(серб)	()
10 January 2022	gazeta.ru	https://www.gazeta.ru/sport/news/2022/01/15/17143783.shtml	президент сербии заявил  что страна  ответит  за джоковича   газета ru	True	306911	(?=.*).*	(серб)	()
17 January 2022	gazeta.ru	https://www.gazeta.ru/politics/2022/01/17/14428225.shtml	сербия сидит на двух стульях  но выбор между россией и западом ей сделать придется	True	314020	(?=.*).*	(серб)	()
7 February 2022	gazeta.ru	https://www.gazeta.ru/science/2022/02/07/14504509.shtml	девочку тоже не пощадили   как усташи расправились над сербами баня луки	True	307487	(?=.*).*	(серб)	()
21 February 2022	gazeta.ru	https://www.gazeta.ru/politics/news/2022/02/23/17332099.shtml	в сербии заявили  что нато хочет задушить россию   газета ru	True	308251	(?=.*).*	(серб)	()
28 February 2022	gazeta.ru	https://www.gazeta.ru/politics/2022/03/05/14602147.shtml	не все понимают  но поддерживают   почему сербы вышли на митинг в поддержку россии	True	309316	(?=.*).*	(серб)	()
28 February 2022	gazeta.ru	https://www.gazeta.ru/politics/2022/03/05/14602147.shtml	не все понимают  но поддерживают   почему сербы вышли на митинг в поддержку россии	True	310089	(?=.*).*	(серб)	()
4 April 2022	gazeta.ru	https://www.gazeta.ru/politics/2022/04/08/14713837.shtml	теперь вучичу будет несладко   почему сербия голосует против россии в оон	True	310799	(?=.*).*	(серб)	()
3 January 2022	riafan.ru	https://riafan.ru/1582118-prezident-serbii-vuchich-osmotrel-zakuplennye-v-rossii-ptrk-kornet	президент сербии вучич осмотрел закупленные в россии птрк  корнет	True	412831	(?=.*).*	(серб)	()
3 January 2022	riafan.ru	https://riafan.ru/1582303-zaharova-napomnila-nato-o-zavisimosti-oboronosposobnosti-serbii-ot-rossii	захарова напомнила нато о зависимости обороноспособности сербии от россии	True	413056	(?=.*).*	(серб)	()
10 January 2022	riafan.ru	https://riafan.ru/1587200-vuchich-serbiya-ne-rassmatrivaet-vozmozhnost-chlenstva-v-nato	вучич  сербия не рассматривает возможность членства в нато	True	415578	(?=.*).*	(серб)	()
10 January 2022	riafan.ru	https://riafan.ru/1589133-v-serbii-nachalsya-referendum-po-izmeneniyu-konstitucii-v-sfere-pravosudiya	в сербии начался референдум по изменению конституции в сфере правосудия	True	409644	(?=.*).*	(серб)	()
17 January 2022	riafan.ru	https://riafan.ru/1591075-volodin-obsudil-so-spikerom-parlamenta-serbii-dachichem-dvustoronnie-otnosheniya	володин обсудил со спикером парламента сербии дачичем двусторонние отношения	True	404592	(?=.*).*	(серб)	()
24 January 2022	riafan.ru	https://riafan.ru/1594529-serbiya-po-zaprosu-manamy-ekstradirovala-grazhdanina-bakhreina-vopreki-zapretu-espch	сербия по запросу манамы экстрадировала гражданина бахрейна вопреки запрету еспч	True	409273	(?=.*).*	(серб)	()
31 January 2022	riafan.ru	https://riafan.ru/1598356-deportirovannogo-iz-serbii-omicha-budut-sudit-za-narkotorgovlyu	депортированного из сербии омича будут судить за наркоторговлю	True	406218	(?=.*).*	(серб)	()
14 February 2022	tass.ru	https://tass.ru/mezhdunarodnaya-panorama/13763677	в лнр сообщили об обстреле из тяжелых минометов районов донецкого и славяносербска	True	269591	(?=.*).*	(серб)	()
14 February 2022	tass.ru	https://tass.ru/mezhdunarodnaya-panorama/13768007	вучич заявил  что сербия никогда не вступит в нато и продолжит сотрудничать с рф и кнр	True	259716	(?=.*).*	(серб)	()
14 February 2022	tass.ru	https://tass.ru/mezhdunarodnaya-panorama/13771407	вучич заявил  что сербия запросит у рф информацию о наборе наемников из косова в донбасс	True	260191	(?=.*).*	(серб)	()
14 February 2022	tass.ru	https://tass.ru/mezhdunarodnaya-panorama/13773887	президент сербии созвал экстренное заседание совбеза страны по ситуации на востоке европы	True	259678	(?=.*).*	(серб)	()
14 February 2022	tass.ru	https://tass.ru/mezhdunarodnaya-panorama/13777307	сербский депутат опубликовал открытое письмо в поддержку жителей донбасса	True	265940	(?=.*).*	(серб)	()
21 February 2022	tass.ru	https://tass.ru/ekonomika/13782879	росатом в      году сдаст два объекта в боливии и приступит к сооружению цянт в сербии	True	264088	(?=.*).*	(серб)	()
21 February 2022	tass.ru	https://tass.ru/ekonomika/13804275	в марте сербия намерена начать с россией переговоры по газовому контракту на    лет	True	265092	(?=.*).*	(серб)	()
21 February 2022	tass.ru	https://tass.ru/ekonomika/13809515	президент сербии считает  что европа не сможет без российского газа	True	264057	(?=.*).*	(серб)	()
21 February 2022	tass.ru	https://tass.ru/mezhdunarodnaya-panorama/13808067	экс посол сербии в рф считает  что нато пытается окружить и задушить россию	True	264195	(?=.*).*	(серб)	()
21 February 2022	tass.ru	https://tass.ru/obschestvo/13818889	посольство россии передало сербским исследователям исторические документы времен вов	True	263900	(?=.*).*	(серб)	()
21 February 2022	tass.ru	https://tass.ru/obschestvo/13821255	министр внутренних дел сербии поздравил шойгу с днем защитника отечества	True	261750	(?=.*).*	(серб)	()
21 February 2022	tass.ru	https://tass.ru/mezhdunarodnaya-panorama/13868887	спикер парламента сербии  запад забывает  что международное право было нарушено в косове	True	261171	(?=.*).*	(серб)	()
21 February 2022	tass.ru	https://tass.ru/kultura/13871369	в сербии открылся белградский международный кинофестиваль fest	True	269241	(?=.*).*	(серб)	()
21 February 2022	tass.ru	https://tass.ru/obschestvo/13884783	сербский ветеран опубликовал фото натовских бомбежек югославии  а их приняли за украинские	True	260339	(?=.*).*	(серб)	()
28 February 2022	tass.ru	https://tass.ru/mezhdunarodnaya-panorama/13889237	спикер парламента сербии считает  что украина стала разменной монетой для запада и рф	True	265851	(?=.*).*	(серб)	()
28 February 2022	tass.ru	https://tass.ru/mezhdunarodnaya-panorama/13913231	вучич предложил прозападным силам победить на выборах в сербии  а потом запрещать sputnik	True	266843	(?=.*).*	(серб)	()
28 February 2022	tass.ru	https://tass.ru/ekonomika/13940365	вучич  в случае затруднений сербия предложит рф выкупить российские компании в стране	True	266787	(?=.*).*	(серб)	()
28 February 2022	tass.ru	https://tass.ru/mezhdunarodnaya-panorama/13928603	в парламенте сербии заявили  что запад потерял право читать лекции о морали после косова	True	267041	(?=.*).*	(серб)	()
28 February 2022	tass.ru	https://tass.ru/obschestvo/13941031	ес заблокировал кабельное вещание rt в сербии	True	264741	(?=.*).*	(серб)	()
2 May 2022	rbc.ru	https://www.rbc.ru/politics/05/05/2022/6273ae8a9a794780c489ebe4	вучич заявил  что слова путина о косово усложнили позицию сербии	True	202862	(?=.*).*	(серб)	()
